score,pubdate,source,title,link
44,2025-07-09-16-39-00 +0000,wsj,"Businesses hoping for clarity on where Trump tariffs land will likely have to wait a bit longer. For now, here’s where things stand.",https://www.wsj.com/economy/trade/trump-tariffs-countries-goods-explained-b9878e1a
39,2025-07-10-01-17-00 +0000,wsj,A brewing debate inside the Federal Reserve over how to address risks posed by President Trump’s tariffs threatens to end a period of relative unity,https://www.wsj.com/economy/central-banking/what-division-inside-the-fed-means-for-future-rate-cuts-c5a9bdb8
34,2025-07-10-12-04-11 +0000,nyt,"Trump Pledges 50% Tariffs Against Brazil, Citing ‘Witch Hunt’ Against Bolsonaro",https://www.nytimes.com/2025/07/09/world/americas/brazil-trump-bolsonaro-lula-coup-tariff.html
32,2025-07-10-01-07-30 +0000,bbc,Trump threatens Brazil with 50% tariff and demands Bolsonaro's trial end,https://www.bbc.com/news/articles/c784ee81y4zo
30,2025-07-10-04-00-09 +0000,nyt,His Start-Up May Not Survive Chaotic Rollout of Trump’s Tariffs,https://www.nytimes.com/2025/07/10/business/trump-tariffs-china.html
30,2025-07-10-11-30-07 +0000,bbc,Brazil vows to match US tariffs after Trump threatens 50% levy,https://www.bbc.com/news/articles/c62dvyv60z7o
29,2025-07-09-23-21-48 +0000,bbc,"Watch: Trump praises Liberian president's English, the country's official language",https://www.bbc.com/news/videos/cdxl4gknwgno
29,2025-07-09-19-47-41 +0000,nyt,Can Canada Leverage Its Unique U.S. Relationship During Tariff Talks With Trump?,https://www.nytimes.com/2025/07/09/world/canada/tariffs-trump-trade-us.html
27,2025-07-10-06-00-21 +0000,bbc,'Trump was right' - John Kerry says Democrats allowed migrant 'siege' of US border,https://www.bbc.com/news/articles/cr4wk52rwqpo
27,2025-07-09-20-22-16 +0000,bbc,"Detained in immigration raids, Maga mom still has faith in Trump's mass deportation plan",https://www.bbc.com/news/articles/c3vd1vn9n06o
25,2025-07-10-12-58-58 +0000,bbc,Five things Trump should know about Liberia and why they speak 'good English',https://www.bbc.com/news/articles/c5y72w17vpwo
24,2025-07-09-20-53-18 +0000,bbc,Why Trump invited five African leaders to the White House,https://www.bbc.com/news/articles/c5ygqenwx78o
24,2025-07-10-10-48-57 +0000,nyt,Rubio Visits Asia as Trump Raises Trade-War Tensions,https://www.nytimes.com/2025/07/09/world/asia/rubio-asia-diplomacy-tariffs.html
23,2025-07-10-09-54-24 +0000,bbc,Secret Service suspended staff for failings over Trump assassination attempt,https://www.bbc.com/news/articles/cy0w9ev559ro
23,2025-07-10-12-44-32 +0000,nyt,How El Salvador Is Reaping Rewards From Trump’s Deportation Agenda,https://www.nytimes.com/2025/07/10/world/americas/trump-migrants-el-salvador-bukele.html
22,2025-07-09-18-26-10 +0000,bbc,Police preparing for Donald Trump to visit Scotland,https://www.bbc.com/news/articles/cm20xvgmd8yo
21,2025-07-09-20-25-00 +0000,wsj,Minutes from the Fed’s June policy meeting tease at a looming split over whether and when officials will resume rate cuts,https://www.wsj.com/economy/central-banking/june-fed-minutes-inflation-interest-rates-4911925c
18,2025-07-09-19-48-23 +0000,nyt,Former President Yoon Suk Yeol of South Korea Is Arrested on New Charges,https://www.nytimes.com/2025/07/09/world/asia/south-korea-arrest-yoon-suk-yeol.html
17,2025-07-10-08-07-40 +0000,bbc,Chris Mason: Migrant deal will be seen as failure if numbers don't fall,https://www.bbc.com/news/articles/cly8mk006kvo
16,2025-07-09-16-28-07 +0000,nyt,"Israel’s Deadly Assault on Iran Prison Incites Fury, Even Among Dissidents",https://www.nytimes.com/2025/07/06/world/middleeast/israel-iran-evin-prison.html
16,2025-07-09-15-36-01 +0000,bbc,Ancelotti gets jail term for tax evasion but will not go to prison,https://www.bbc.com/sport/football/articles/czeyjw0nx27o
16,2025-07-09-20-36-58 +0000,bbc,'Huge wall of water': Texas man stood on meter box to survive deadly floods,https://www.bbc.com/news/articles/c3358pz41d6o
15,2025-07-09-17-23-34 +0000,nyt,"‘Ne Zha 2,’ Blockbuster Chinese Animated Film, Will Get English Version",https://www.nytimes.com/2025/07/09/movies/ne-zha-2-english-us-theaters.html
15,2025-07-10-11-09-28 +0000,bbc,Back-to-back floods in New Mexico and Texas with very different outcomes,https://www.bbc.com/news/articles/c5y022wp009o
15,2025-07-09-19-04-54 +0000,bbc,Watch: Timelapse shows floodwaters swamping New Mexico store,https://www.bbc.com/news/videos/cx23ydrvvrwo
14,2025-07-10-08-11-18 +0000,nyt,China Surveys Seabeds Where Naval Rivals May One Day Clash,https://www.nytimes.com/2025/07/10/world/asia/china-ships-taiwan-guam.html
14,2025-07-09-18-22-01 +0000,nyt,"Israel Launches New Ground Incursion in Lebanon, Raising Fears for Truce",https://www.nytimes.com/2025/07/09/world/middleeast/israel-lebanon.html
13,2025-07-09-23-26-54 +0000,nyt,Mexico Sentences 10 Men to 140 Years Each in Prison for Links to Killing at Cartel Ranch,https://www.nytimes.com/2025/07/09/world/americas/mexico-izaguirre-ranch-cartel.html
13,2025-07-10-09-22-00 +0000,wsj,"Tariff Anxiety Spreading Across Japan, BOJ Report Shows",https://www.wsj.com/world/asia/tariff-anxiety-spreading-across-japan-boj-report-shows-ca788637
12,2025-07-09-22-17-48 +0000,bbc,Ex-Tory chairman Jake Berry defects to Reform UK,https://www.bbc.com/news/articles/cx24lll3n99o
12,2025-07-10-10-14-50 +0000,nyt,Southern China and Hong Kong Brace for Floods and Fierce Winds from Danas,https://www.nytimes.com/2025/07/10/world/asia/typhoon-danas-rain-flooding-china-hong-kong.html
12,2025-07-10-05-25-38 +0000,bbc,Reform leader says council first to scrap net zero,https://www.bbc.com/news/articles/c3vde31lwpdo
12,2025-07-10-10-06-57 +0000,bbc,South Africans fear spike in HIV infections as US aid cuts bite,https://www.bbc.com/news/articles/ce83r14vlnpo
12,2025-07-10-01-12-47 +0000,nyt,Umbrellas Optional? East Asia’s Monsoon Rains Are No Longer a Sure Thing,https://www.nytimes.com/2025/07/09/world/asia/monsoon-season-south-korea-japan.html
12,2025-07-10-11-55-37 +0000,bbc,"UK faces rising and unpredictable threat from Iran, report warns",https://www.bbc.com/news/articles/c98wjzj4jlpo
11,2025-07-09-21-57-53 +0000,bbc,Chebbak hat-trick helps Morocco avoid DR Congo upset at Wafcon,https://www.bbc.com/sport/football/articles/cx24e3z8y6jo
11,2025-07-10-05-35-00 +0000,wsj,June’s U.K. Home Buyer Demand Turns Positive for the First Time Since December,https://www.wsj.com/economy/central-banking/junes-u-k-home-buyer-demand-turns-positive-for-the-first-time-since-december-0bf9a9cd
11,2025-07-10-04-42-37 +0000,bbc,Chris Mason: Reform's momentum is making the political weather,https://www.bbc.com/news/articles/c1e0vq4gxeno
11,2025-07-09-21-07-59 +0000,bbc,'Shoot in the leg' - Kenyan leader orders police to curb violent protests,https://www.bbc.com/news/articles/c9dgv5e6447o
10,2025-07-10-12-17-37 +0000,bbc,US cuts visa validity for applicants from three African countries,https://www.bbc.com/news/articles/cx23ywg9w82o
10,2025-07-10-04-27-20 +0000,bbc,Former Love Island USA contestant apologises for using slur in post,https://www.bbc.com/news/articles/c0epr2vdwq3o
10,2025-07-09-21-34-15 +0000,nyt,"Yemen’s Houthi Militia Took Sailors Hostage After Red Sea Attack, U.S. Says",https://www.nytimes.com/2025/07/09/world/middleeast/houthis-red-sea-hostages.html
10,2025-07-09-23-10-00 +0000,bbc,US lawmakers write to Canada to complain that its wildfire smoke is spoiling summer,https://www.bbc.com/news/articles/czjkgg0kk3lo
10,2025-07-09-16-40-00 +0000,bbc,UK must refuse to take male small boat migrants - Farage,https://www.bbc.com/news/articles/c4g8rqlxn2vo
10,2025-07-10-11-26-04 +0000,bbc,"Open up places with air-con to help in heatwave, say Lib Dems",https://www.bbc.com/news/articles/c20r53ex631o
9,2025-07-09-14-11-30 +0000,nyt,"After Decades as Enemies, Syria and Israel Now Share a Common Foe",https://www.nytimes.com/2025/07/09/world/middleeast/syria-israel-talks.html
9,2025-07-09-16-29-27 +0000,bbc,Bin lorry drivers face axe as strike talks fail,https://www.bbc.com/news/articles/crk6rz4lg20o
9,2025-07-09-14-40-13 +0000,bbc,Lesotho declares state of disaster amid US tariff uncertainty,https://www.bbc.com/news/articles/c4g8re5el87o
9,2025-07-09-13-06-03 +0000,nyt,Canadian Armed Group Charged in Plot to Seize Quebec Land,https://www.nytimes.com/2025/07/08/world/canada/terrorist-plot-charges-canada-quebec.html
8,2025-07-10-12-18-58 +0000,nyt,The Calgary Stampede Captures Canada’s Western Spirit,https://www.nytimes.com/2025/07/10/world/canada/calgary-stampede-rodeo.html
8,2025-07-09-14-57-56 +0000,bbc,Starmer refuses to rule out freeze on tax thresholds,https://www.bbc.com/news/articles/cvg1p1pwxn6o
8,2025-07-10-12-29-09 +0000,nyt,"Maya Ruler’s Tomb Is Unearthed in Belize, With Clues to His Ancient World",https://www.nytimes.com/2025/07/10/world/americas/maya-tomb-caracol-belize.html
8,2025-07-10-02-40-00 +0000,wsj,Bank of Korea Holds Rates as Growth Concerns Ebb,https://www.wsj.com/articles/bank-of-korea-holds-rates-as-growth-concerns-ebb-e129a1e2
7,2025-07-09-21-02-10 +0000,nyt,Thursday Briefing: Russia’s Record Drone Attack,https://www.nytimes.com/2025/07/09/briefing/ukraine-russia-trump-trade-south-korea-yoon.html
7,2025-07-10-12-44-50 +0000,bbc,"Ban some foreigners from sickness benefits, Tories urge",https://www.bbc.com/news/articles/c80p1gdvyggo
7,2025-07-09-23-01-22 +0000,bbc,'I can't drink the water' - life next to a US data centre,https://www.bbc.com/news/articles/cy8gy7lv448o
7,2025-07-10-10-31-09 +0000,bbc,Semenya's right to a fair hearing violated - ECHR,https://www.bbc.com/sport/olympics/articles/c7vr04v3vpdo
7,2025-07-10-12-20-09 +0000,nyt,A British Surgeon Shares What She Saw in Gaza’s Hospitals,https://www.nytimes.com/2025/07/09/world/middleeast/gaza-hospitals-uk-surgeon-israel-attacks.html
7,2025-07-10-08-57-22 +0000,bbc,Government's watered-down benefits bill clears Commons,https://www.bbc.com/news/articles/cm2zyvypmeeo
7,2025-07-10-09-52-55 +0000,bbc,Plan for electricity bills based on region dropped,https://www.bbc.com/news/articles/cdr3e78112po
6,2025-07-10-09-34-46 +0000,nyt,U.S. Imposes Sanctions on U.N. Special Rapporteur Francesca Albanese,https://www.nytimes.com/2025/07/10/us/politics/gaza-francesca-albanese-sanctions.html
6,2025-07-10-12-50-49 +0000,nyt,K-Pop Singer Taeil Sentenced to 3½-Years in Rape of Tourist,https://www.nytimes.com/2025/07/10/world/asia/kpop-taeil-sentenced-sex-crime.html
6,2025-07-10-11-14-00 +0000,wsj,Irish Factory Output Rebounds as Exports to U.S. Rise,https://www.wsj.com/economy/irish-factory-output-rebounds-as-exports-to-u-s-rise-e2549d64
6,2025-07-10-08-29-32 +0000,bbc,MP takes break from Parliament due to illness,https://www.bbc.com/news/articles/cjel15wnyyyo
6,2025-07-09-15-07-26 +0000,bbc,Tunisian opposition leader jailed for 14 years,https://www.bbc.com/news/articles/c04d1d71rx4o
6,2025-07-09-22-01-21 +0000,bbc,Everything you need to know about Wafcon 2024 finals,https://www.bbc.com/sport/football/articles/cqj7k2pwx4no
5,2025-07-09-19-47-26 +0000,bbc,Linda Yaccarino departs as boss of Musk's X,https://www.bbc.com/news/articles/cx2gy3j9xq6o
3,2025-07-10-12-53-00 +0000,wsj,U.S. Jobless Claims Fell Last Week,https://www.wsj.com/economy/jobs/u-s-jobless-claims-fell-last-week-fb0df0b3
