score,pubdate,source,title,link
35,2025-07-11-19-40-14 +0000,nyt,Trump’s Latest Canada Tariff Threats Come Despite Cordial Negotiations With Carney,https://www.nytimes.com/2025/07/11/world/canada/canada-trump-tariffs-trade-talks.html
35,2025-07-11-13-41-59 +0000,cbc,CUSMA-compliant goods exempt from Trump's latest tariff threat on Canada,https://www.cbc.ca/news/business/trump-tariff-cusma-1.7582740?cmp=rss
31,2025-07-11-14-53-00 +0000,wsj,"Businesses hoping for clarity on where Trump tariffs land will likely have to wait a bit longer. For now, here’s where things stand.",https://www.wsj.com/economy/trade/trump-tariffs-countries-goods-explained-b9878e1a
29,2025-07-11-13-13-32 +0000,cbc,RECAP | Trump's latest tariff threat sends trade into fresh state of uncertainty,https://www.cbc.ca/news/politics/livestory/recap-trump-s-latest-tariff-threat-sends-trade-into-fresh-state-of-uncertainty-9.6828157?cmp=rss
25,2025-07-11-23-05-58 +0000,bbc,Canada's Carney talked tough on Trump - now some say he's backing down,https://www.bbc.com/news/articles/cvg81518yyyo
24,2025-07-11-00-46-03 +0000,cbc,Trump threatening 35% tariffs on Canadian goods across the board,https://www.cbc.ca/news/politics/trump-35-per-cent-tariffs-1.7582563?cmp=rss
22,2025-07-11-00-45-05 +0000,bbc,Asia is reeling from Trump's tariff salvo – is anyone winning?,https://www.bbc.com/news/articles/ckg5l2yy42eo
21,2025-07-11-19-22-18 +0000,bbc,Trump threatens 35% tariffs on Canadian goods,https://www.bbc.com/news/articles/cvg819n954mo
21,2025-07-11-18-54-00 +0000,wsj,"Latest Tariff Threats Could Delay Rate Cuts, Chicago Fed’s Goolsbee Says",https://www.wsj.com/economy/central-banking/latest-tariff-threats-could-delay-rate-cuts-chicago-feds-goolsbee-says-ff7e83a8
20,2025-07-11-11-21-26 +0000,nyt,Behind Trump’s Decision to Tax Brazil to Save Bolsonaro,https://www.nytimes.com/2025/07/11/world/americas/brazil-trump-tariffs.html
19,2025-07-11-21-44-35 +0000,nyt,How El Salvador Is Reaping Rewards From Trump’s Deportation Agenda,https://www.nytimes.com/2025/07/10/world/americas/trump-migrants-el-salvador-bukele.html
19,2025-07-11-01-50-02 +0000,bbc,Judge blocks Trump's birthright order after Supreme Court ruling,https://www.bbc.com/news/articles/c0l4jw5glplo
19,2025-07-11-20-46-00 +0000,wsj,A dispute over the Federal Reserve’s renovation of its headquarters could provide the pretext to attempt the removal of Fed chief Jerome Powell over interest-rate disagreements,https://www.wsj.com/economy/central-banking/jerome-powell-fed-renovations-trump-fb9793df
18,2025-07-11-23-26-14 +0000,bbc,Trump surveys damage in Texas as search continues for 160 missing,https://www.bbc.com/news/articles/cr5vlp0pmdzo
15,2025-07-11-17-37-00 +0000,wsj,"Nuclear power exemplifies how revamping dated and onerous rules could kick-start investment and innovation, writes the WSJ’s Greg Ip",https://www.wsj.com/economy/trumps-unsung-economic-booster-deregulation-e46bce0b
15,2025-07-11-16-41-00 +0000,wsj,Canada Unemployment Rate Slips to 6.9% in June,https://www.wsj.com/economy/central-banking/canada-unemployment-rate-slips-to-6-9-in-june-ba2bbd79
14,2025-07-11-12-48-16 +0000,cbc,"Canada added 83,000 jobs in June, sending unemployment down slightly",https://www.cbc.ca/news/business/job-numbers-june-1.7582664?cmp=rss
13,2025-07-11-18-22-44 +0000,nyt,Republicans Blame Canada for Wildfire Smoke ‘Suffocating’ the U.S.,https://www.nytimes.com/2025/07/11/world/canada/wildfire-smoke-manitoba-us-congress.html
13,2025-07-11-16-24-19 +0000,bbc,Russians tell the BBC how they think the Ukraine war will end,https://www.bbc.com/news/videos/c1wp55wqq0lo
12,2025-07-11-15-41-42 +0000,bbc,"Gaza's largest functioning hospital facing disaster, medics warn, as Israel widens offensive",https://www.bbc.com/news/articles/cdx5zeywgrgo
12,2025-07-11-02-39-47 +0000,bbc,Watch: Smoke billows from luxury yacht fire in St Tropez,https://www.bbc.com/news/videos/c4g85005q93o
11,2025-07-11-08-14-13 +0000,bbc,'I created it myself': The boy behind the viral 'aura farming' boat racing dance,https://www.bbc.com/news/articles/czxe7ey59r0o
11,2025-07-11-22-10-00 +0000,bbc,Arizona wildfires and extreme heat  prompt evacuations near Grand Canyon,https://www.bbc.com/news/articles/czjk10wwmkeo
11,2025-07-11-15-47-19 +0000,bbc,Watch: Moment child gets stuck inside a claw machine,https://www.bbc.com/news/videos/cy8kgg5l037o
10,2025-07-11-05-02-58 +0000,bbc,Afghan taxi drivers beat the heat with handmade air coolers,https://www.bbc.com/news/articles/cd6gzgvd9vxo
10,2025-07-11-08-57-33 +0000,bbc,Watch: Child migrants' fears trying to cross the Channel,https://www.bbc.com/news/videos/c36x3k6y4zzo
10,2025-07-11-08-06-08 +0000,bbc,"UK-France migrant deal 'robust' against legal challenges, Cooper says",https://www.bbc.com/news/articles/cx24d70gw41o
10,2025-07-11-09-25-00 +0000,wsj,"ECB’s Bar for Another Rate Cut Is High, Schnabel Says",https://www.wsj.com/articles/ecbs-bar-for-another-rate-cut-is-high-schnabel-says-fe302495
10,2025-07-11-19-39-41 +0000,nyt,"Evidence Supports War Crimes Allegations in Darfur, I.C.C. Prosecutor Says",https://www.nytimes.com/2025/07/11/world/africa/sudan-darfur-war-crimes.html
10,2025-07-11-09-00-37 +0000,nyt,"In ‘Apocalypse in the Tropics,’ Director Petra Costa Examines Brazil’s Rightward Shift",https://www.nytimes.com/2025/07/11/movies/petra-costa-brazil-politics-documentary.html
10,2025-07-11-11-50-01 +0000,bbc,"War crimes being committed in Sudan, ICC believes",https://www.bbc.com/news/articles/cvg819yxkp5o
10,2025-07-11-14-27-19 +0000,bbc,Kurdish PKK burns guns in cauldron in big step towards ending Turkey conflict,https://www.bbc.com/news/articles/cyvj5v67ly9o
10,2025-07-11-21-11-54 +0000,bbc,US court rejects plea deal for '9/11 mastermind' Khalil Sheikh Mohammed,https://www.bbc.com/news/articles/c78nxqqp2leo
10,2025-07-11-21-33-21 +0000,cbc,Ethics commissioner publishes list of PM Carney's investments,https://www.cbc.ca/news/politics/mark-carney-financial-assets-1.7583443?cmp=rss
9,2025-07-11-23-36-00 +0000,bbc,Flight from London to Cancun lands in US after fight breaks out on board,https://www.bbc.com/news/articles/c98jqve2q7mo
9,2025-07-11-22-56-21 +0000,nyt,"Maya Ruler’s Tomb Is Unearthed in Belize, With Clues to His Ancient World",https://www.nytimes.com/2025/07/10/world/americas/maya-tomb-caracol-belize.html
9,2025-07-11-22-28-20 +0000,bbc,Trade trumps geopolitics as Australia PM visits China,https://www.bbc.com/news/articles/c7vrjlp5zdvo
9,2025-07-11-22-40-54 +0000,bbc,An Indigenous Australian community is fighting to protect sacred springs from a coal mine,https://www.bbc.com/news/articles/ckglj211x9yo
9,2025-07-11-18-56-19 +0000,nyt,Haiti’s Landmark Oloffson Hotel is Destroyed in an Apparent Arson Fire,https://www.nytimes.com/2025/07/07/world/americas/haiti-oloffson-hotel-fire-port-au-prince.html
9,2025-07-11-20-40-22 +0000,nyt,Son of El Chapo Pleads Guilty to Sweeping Drug Charges,https://www.nytimes.com/2025/07/11/us/politics/el-chapo-son-pleads-guilty.html
9,2025-07-11-13-26-30 +0000,nyt,Manitoba Declares Second Wildfire Emergency in a Near-Record Year,https://www.nytimes.com/2025/07/11/world/canada/manitoba-wildfires-2025.html
9,2025-07-11-09-51-33 +0000,bbc,"Texans did not immediately receive flood alerts after request, audio reveals",https://www.bbc.com/news/articles/cq537dp2ello
8,2025-07-11-11-55-51 +0000,bbc,Outrage builds over plan to force all Gazans to southern city,https://www.bbc.com/news/articles/c9dgv7v1d06o
8,2025-07-11-16-04-05 +0000,bbc,Dozens taken to hospital after suspected mass overdose in Baltimore,https://www.bbc.com/news/articles/cp8m5jggjdgo
8,2025-07-11-00-27-06 +0000,bbc,'We're worried about our future': Srebrenica massacre's tensions still felt 30 years on,https://www.bbc.com/news/articles/c4g2edzg2wlo
7,2025-07-11-05-00-27 +0000,bbc,Starmer and Macron plead for patience in an impatient world,https://www.bbc.com/news/articles/clynxqdr157o
7,2025-07-11-22-53-15 +0000,bbc,BBC correspondent explains the role of fuel switches,https://www.bbc.com/news/videos/cx2vrdd5xkeo
7,2025-07-11-18-25-39 +0000,cbc,Dealerships on hook for unpaid EV rebates have a month to get their claims in,https://www.cbc.ca/news/politics/ev-rebate-claims-1.7583119?cmp=rss
7,2025-07-11-13-34-12 +0000,bbc,"Iran could recover some enriched uranium after US strikes, Israeli official says",https://www.bbc.com/news/articles/cn0qzxvydz1o
6,2025-07-11-22-56-32 +0000,bbc,"US has resumed military supplies to Ukraine, Zelensky says",https://www.bbc.com/news/articles/crl04200dp4o
6,2025-07-11-17-05-44 +0000,bbc,Lukewarm reviews for Justin Bieber's surprise album,https://www.bbc.com/news/articles/ce8zwz0jp17o
6,2025-07-11-15-53-00 +0000,wsj,"Week Ahead for FX, Bonds: U.S. Inflation Data in Focus",https://www.wsj.com/economy/week-ahead-for-fx-bonds-u-s-inflation-data-in-focus-44a8d97a
6,2025-07-11-11-17-26 +0000,bbc,Afghan cabbies' DIY solution to keep cool,https://www.bbc.com/news/videos/cgjgznve666o
5,2025-07-11-13-41-02 +0000,bbc,More than 150 arrests in global human trafficking crackdown,https://www.bbc.com/news/articles/c36x3z1k18no
5,2025-07-11-06-59-00 +0000,wsj,U.K. Economy Unexpectedly Slumps to Second Straight Month of Contraction,https://www.wsj.com/economy/global/u-k-economy-slumps-to-second-straight-month-of-contraction-40cb4c11
4,2025-07-11-13-52-37 +0000,bbc,"Nigeria can't take Venezuelan deportees from US, minister says",https://www.bbc.com/news/articles/c23gz78v5jjo
