score,pubdate,source,title,link
44,2025-07-08-01-05-00 +0000,wsj,"President Trump reignited his global trade war Monday, renewing his threat to hit partners with punishing tariffs even as he announced a three-week extension to negotiate deals",https://www.wsj.com/economy/trade/trump-tariffs-deadline-august-trade-war-e916eb77
40,2025-07-08-21-38-00 +0000,wsj,"Businesses hoping for clarity on where Trump tariffs land will likely have to wait a bit longer. For now, here’s where things stand.",https://www.wsj.com/economy/trade/trump-tariffs-countries-goods-explained-b9878e1a
27,2025-07-08-04-00-11 +0000,nyt,Trump and Netanyahu Meet Amid Gaza Cease-Fire Negotiations,https://www.nytimes.com/2025/07/07/us/politics/trump-netanyahu-dinner-gaza-cease-fire.html
27,2025-07-08-20-58-00 +0000,wsj,Copper prices surged and the Dow industrials slipped after President Trump announced a large tariff on imports of the metal,https://www.wsj.com/economy/trade/trumps-tariffs-send-copper-to-record-dow-industrials-slip-bcfba898
26,2025-07-08-22-37-57 +0000,bbc,Trump and Netanyahu meet for a second time amid Gaza ceasefire talks,https://www.bbc.com/news/articles/ce3newwl1zeo
25,2025-07-08-23-01-40 +0000,bbc,Faisal Islam: Trump delays tariffs as the rest of world plays hardball,https://www.bbc.com/news/articles/c628nk51364o
23,2025-07-08-20-53-56 +0000,bbc,"US will hike tariffs on copper to 50%, Trump says",https://www.bbc.com/news/articles/cjrljr8qv3zo
22,2025-07-08-12-22-25 +0000,bbc,Trump upbeat on Gaza ceasefire talks despite lack of breakthrough,https://www.bbc.com/news/articles/c2k14n9d8y9o
20,2025-07-08-14-31-42 +0000,nyt,The Mexican Businessman Grateful for Trump’s Tariffs,https://www.nytimes.com/2025/07/08/world/americas/mexico-trump-tariffs.html
19,2025-07-08-10-00-45 +0000,nyt,Where Do Israel-Hamas Cease-Fire Negotiations Stand?,https://www.nytimes.com/article/israel-hamas-ceasefire-negotiations.html
17,2025-07-08-15-11-47 +0000,nyt,"Trump’s Budget Would Clip Bird Banding, and Hunters Are Not Happy",https://www.nytimes.com/2025/07/08/science/trump-budget-birds-banding-hunters.html
17,2025-07-08-09-29-38 +0000,bbc,Post Office report set to lay bare human impact of IT scandal,https://www.bbc.com/news/articles/c4g267xe3y6o
17,2025-07-08-01-13-56 +0000,nyt,"Israel’s Deadly Assault on Iran Prison Incites Fury, Even Among Dissidents",https://www.nytimes.com/2025/07/06/world/middleeast/israel-iran-evin-prison.html
16,2025-07-08-16-16-33 +0000,bbc,Post Office scandal had 'disastrous' impact on victims,https://www.bbc.com/news/articles/cz9k4lvg77lo
16,2025-07-08-11-00-00 +0000,wsj,Tariff Uncertainty Likely to Weigh on Global Growth Even After Extended Talks,https://www.wsj.com/economy/trade/tariff-uncertainty-likely-to-weigh-on-global-growth-even-after-extended-talks-6111469a
15,2025-07-08-03-59-26 +0000,bbc,US delays higher tariffs but announces new taxes for some countries,https://www.bbc.com/news/articles/cd0vkl31085o
15,2025-07-08-19-50-53 +0000,bbc,UK's pension triple lock to cost three times more,https://www.bbc.com/news/articles/cy7nv3pdgr4o
15,2025-07-08-23-03-23 +0000,bbc,"'Hero' dad, twin girls and riverside campers among Texas flood victims",https://www.bbc.com/news/articles/c5ygl8lpyyqo
14,2025-07-08-16-25-45 +0000,bbc,"Exhausted, angry, heartbroken: Postmasters react as horror of scandal laid bare",https://www.bbc.com/news/articles/c1wp9xjey9do
13,2025-07-08-19-52-56 +0000,bbc,"Canadian Armed Forces members plotted 'anti-government militia', police say",https://www.bbc.com/news/articles/cly8d0jxm8po
12,2025-07-08-23-03-35 +0000,bbc,"Action needed to halt exodus of firms leaving UK, says CBI",https://www.bbc.com/news/articles/cz6g85qp0p6o
12,2025-07-08-07-32-00 +0000,wsj,German Exports Fall Again as Tariffs Drag on Economy,https://www.wsj.com/economy/trade/german-exports-fall-again-as-tariffs-drag-on-economy-2a5e7807
12,2025-07-08-16-25-36 +0000,nyt,"As a Tourist Influx Makes Prices Soar, Hundreds Protest in Mexico City",https://www.nytimes.com/2025/07/05/world/americas/mexico-city-protest-gentrification.html
11,2025-07-08-05-40-20 +0000,bbc,'Their house was swept away. We lost three beautiful friends',https://www.bbc.com/news/videos/c70r9ne35rpo
11,2025-07-08-22-12-28 +0000,nyt,Canadian Armed Group Charged in Plot to Seize Quebec Land,https://www.nytimes.com/2025/07/08/world/canada/terrorist-plot-charges-canada-quebec.html
11,2025-07-08-11-54-39 +0000,bbc,Five things we now know about the Post Office scandal,https://www.bbc.com/news/articles/cvgeq7z4ylyo
10,2025-07-08-08-48-38 +0000,nyt,Haiti’s Landmark Oloffson Hotel is Destroyed in an Apparent Arson Fire,https://www.nytimes.com/2025/07/07/world/americas/haiti-oloffson-hotel-fire-port-au-prince.html
10,2025-07-08-16-41-29 +0000,bbc,Imposter used AI to pose as Marco Rubio and contact foreign ministers,https://www.bbc.com/news/articles/crrqkyyjewno
10,2025-07-08-12-25-59 +0000,nyt,Why Are Protesters in Mexico City Angry at Remote Workers?,https://www.nytimes.com/2025/07/07/world/americas/mexico-city-protests-rent-prices-tourists.html
10,2025-07-08-16-48-16 +0000,bbc,ICC issues arrest warrants for Taliban leaders for persecuting women and girls,https://www.bbc.com/news/articles/c98jn0ry8jqo
10,2025-07-08-15-33-43 +0000,nyt,How Do Israel and Hamas Negotiate in Qatar?,https://www.nytimes.com/2025/07/08/world/middleeast/how-do-israel-and-hamas-negotiate-in-qatar.html
10,2025-07-08-17-38-56 +0000,bbc,France and UK to stop small boats together - Macron,https://www.bbc.com/news/articles/cr4wdv69796o
10,2025-07-08-13-05-08 +0000,bbc,Baby stolen during Argentina's military rule found after 48 years,https://www.bbc.com/news/articles/c4gk9j5n50ko
10,2025-07-08-08-17-07 +0000,bbc,Norman Tebbit: Outspoken hero of the Conservative political right,https://www.bbc.com/news/articles/c3g9k9l1g3xo
10,2025-07-08-22-13-12 +0000,bbc,"Ex-Bangladesh leader authorised deadly crackdown, leaked audio suggests",https://www.bbc.com/news/articles/cn4l1z5qd1vo
10,2025-07-08-18-25-58 +0000,nyt,"5 Israeli Soldiers Killed in Gaza, Military Says",https://www.nytimes.com/2025/07/08/world/middleeast/israel-gaza-soldiers-killed.html
9,2025-07-08-23-45-31 +0000,bbc,What happens in Taiwan's Han Kuang military exercise?,https://www.bbc.com/news/articles/cly21zrnk79o
9,2025-07-08-16-19-10 +0000,nyt,Attack on Cargo Ship in the Red Sea Kills 2 Crew Members,https://www.nytimes.com/2025/07/08/world/middleeast/red-sea-ship-attack.html
9,2025-07-08-23-19-34 +0000,nyt,U.S. Botched a Deal to Swap Venezuelans in El Salvador for American Prisoners,https://www.nytimes.com/2025/07/08/world/americas/trump-venezuelan-migrants-us-prisoner-swap.html
9,2025-07-08-14-11-09 +0000,bbc,"Norman Tebbit, key Thatcher ally, dies aged 94",https://www.bbc.com/news/articles/c4gk98ng4e8o
9,2025-07-08-11-35-00 +0000,wsj,Japan Determined to Strike Fair Trade Deal With U.S.,https://www.wsj.com/economy/trade/japan-determined-to-strike-fair-trade-deal-with-u-s-09abb897
9,2025-07-08-12-37-11 +0000,bbc,Emergency alert to be sent to smartphones in UK test,https://www.bbc.com/news/articles/c4ge9xk8wj0o
9,2025-07-08-09-03-12 +0000,bbc,Chef's food decoration at Chinese pre-school poisons 233 children,https://www.bbc.com/news/articles/cy4n7wn8l58o
9,2025-07-08-10-00-36 +0000,bbc,Edinburgh and Birmingham airports increase 100ml liquid limits,https://www.bbc.com/news/articles/clyndvdvd39o
9,2025-07-08-13-07-11 +0000,bbc,Monzo gave accounts to customers faking PM and King's addresses,https://www.bbc.com/news/articles/cqjqgxzz8gjo
9,2025-07-08-12-57-36 +0000,bbc,"Assume the 100ml airport rule remains, flyers told",https://www.bbc.com/news/articles/cvg68v4reylo
9,2025-07-08-17-03-42 +0000,bbc,MP will not return to Reform after Covid loan claims,https://www.bbc.com/news/articles/cjwny5j9gyjo
9,2025-07-08-16-17-13 +0000,bbc,Stats boss quits as minister says new leadership needed,https://www.bbc.com/news/articles/c628ny68xn6o
9,2025-07-08-16-51-42 +0000,bbc,Former PM Rishi Sunak takes job at Goldman Sachs,https://www.bbc.com/news/articles/cy0wpejeg1go
8,2025-07-08-23-10-10 +0000,bbc,Gemma Collins weight-loss drug advert banned,https://www.bbc.com/news/articles/cvgnr0xg7rno
8,2025-07-08-22-54-23 +0000,bbc,US airports lift shoe removal requirement at security screenings,https://www.bbc.com/news/articles/c0m8p3e93m8o
8,2025-07-08-14-15-18 +0000,bbc,Chris Mason: What happens inside the government's crisis room,https://www.bbc.com/news/articles/crrqkv802xzo
8,2025-07-08-22-01-45 +0000,bbc,China's emissions may be falling - here's what you should know,https://www.bbc.com/news/articles/c4gdd6jdm42o
8,2025-07-08-01-26-05 +0000,nyt,Iran Carries Out Mass Expulsion of Afghan Refugees,https://www.nytimes.com/2025/07/07/world/middleeast/iran-afghan-refugees-deportations.html
8,2025-07-08-05-03-00 +0000,wsj,Australia’s Central Bank Surprises Markets by Keeping Rates Steady,https://www.wsj.com/articles/australias-central-bank-surprises-markets-by-keeping-rates-steady-ba035a74
8,2025-07-08-07-18-42 +0000,bbc,Non-disclosure agreements gagging workers to be banned,https://www.bbc.com/news/articles/c93kwgzz88qo
7,2025-07-08-16-52-45 +0000,bbc,Texas floods death toll climbs to at least 107,https://www.bbc.com/news/articles/c0j4eq517qyo
7,2025-07-08-20-08-48 +0000,bbc,US justice department finds no Epstein 'client list',https://www.bbc.com/news/articles/cm2m879neljo
7,2025-07-08-22-00-02 +0000,nyt,"Antigovernment Protests Erupt Across Kenya, Killing Dozens",https://www.nytimes.com/2025/07/08/world/africa/kenya-antigovernment-protests-ruto.html
7,2025-07-08-16-28-32 +0000,bbc,Ministers ditch pet insurance rules for renters,https://www.bbc.com/news/articles/c62d3j7j8ndo
7,2025-07-08-16-07-39 +0000,bbc,What is the triple lock and how much is the state pension worth?,https://www.bbc.com/news/articles/cq6m03ld7nvo
7,2025-07-08-05-44-59 +0000,bbc,Indonesian volcano spews massive ash cloud as it erupts again,https://www.bbc.com/news/articles/cj3r8v13zrro
7,2025-07-08-12-44-59 +0000,bbc,"Children living in 'Dickensian' poverty, commissioner warns",https://www.bbc.com/news/articles/cvg8r3vm4llo
7,2025-07-08-07-30-11 +0000,bbc,Maternity brand worn by Princess of Wales enters administration,https://www.bbc.com/news/articles/c5y9qez8ze3o
6,2025-07-08-14-52-46 +0000,bbc,"Hackers tried to 'destroy' M&S, chair tells MPs",https://www.bbc.com/news/articles/cvg81m2mdmjo
6,2025-07-08-10-28-00 +0000,wsj,U.S. Small-Business Sentiment Darkens Slightly,https://www.wsj.com/economy/u-s-small-business-sentiment-darkens-slightly-3ab159fb
5,2025-07-08-21-52-38 +0000,nyt,The Site of the Jonestown Massacre Is Opening to Tourists,https://www.nytimes.com/2025/07/03/world/americas/jonestown-guyana-tourists.html
5,2025-07-08-10-41-35 +0000,bbc,Campaigners to get refund after energy bill row,https://www.bbc.com/news/articles/c1mz824mz1jo
5,2025-07-08-11-18-04 +0000,bbc,Resident doctors vote to strike in England,https://www.bbc.com/news/articles/cren3l8nj8wo
