score,pubdate,source,title,link
35,2025-07-11-14-53-00 +0000,wsj,"Businesses hoping for clarity on where Trump tariffs land will likely have to wait a bit longer. For now, here’s where things stand.",https://www.wsj.com/economy/trade/trump-tariffs-countries-goods-explained-b9878e1a
31,2025-07-11-19-40-14 +0000,nyt,Trump’s Latest Canada Tariff Threats Come Despite Cordial Negotiations With Carney,https://www.nytimes.com/2025/07/11/world/canada/canada-trump-tariffs-trade-talks.html
29,2025-07-11-21-50-58 +0000,nyt,"As Trump Sows Tariff Confusion, Rules of Global Commerce Give Way to Chaos",https://www.nytimes.com/2025/07/11/world/europe/trump-tariffs-global-trade-deals.html
29,2025-07-11-19-04-37 +0000,nyt,Trump Says NATO Countries Will Buy Weapons to Give to Ukraine,https://www.nytimes.com/2025/07/11/world/europe/trump-nato-weapons-ukraine.html
25,2025-07-11-23-05-58 +0000,bbc,Canada's Carney talked tough on Trump - now some say he's backing down,https://www.bbc.com/news/articles/cvg81518yyyo
25,2025-07-11-10-00-00 +0000,latimes,Contributor: Will Democrats find an anti-Trump to galvanize the left?,https://www.latimes.com/opinion/story/2025-07-11/zohran-mamdani-democratic-presidential-candidate-2028
23,2025-07-11-16-29-33 +0000,nyt,"Germany Takes an Unassuming Approach to Tax Cuts, in Contrast to Trump",https://www.nytimes.com/2025/07/11/world/europe/germany-economy-tax-cuts.html
23,2025-07-12-01-09-58 +0000,latimes,California mayor warns residents amid immigration raids. 'Do not go out unless necessary',https://www.latimes.com/california/story/2025-07-11/california-mayor-cautions-residents-amid-immigration-raids
22,2025-07-11-10-00-00 +0000,latimes,"Barabak: He tried to keep Trump from a second term. But six months in, 'I'm very impressed.'",https://www.latimes.com/politics/story/2025-07-11/trumps-america-oil-and-gas-executive-denver-colorado
22,2025-07-11-11-21-26 +0000,nyt,Behind Trump’s Decision to Tax Brazil to Save Bolsonaro,https://www.nytimes.com/2025/07/11/world/americas/brazil-trump-tariffs.html
21,2025-07-11-21-44-35 +0000,nyt,How El Salvador Is Reaping Rewards From Trump’s Deportation Agenda,https://www.nytimes.com/2025/07/10/world/americas/trump-migrants-el-salvador-bukele.html
20,2025-07-12-01-53-00 +0000,wsj,A dispute over the Federal Reserve’s renovation of its headquarters could provide the pretext to attempt the removal of Fed chief Jerome Powell over interest-rate disagreements,https://www.wsj.com/economy/central-banking/jerome-powell-fed-renovations-trump-fb9793df
20,2025-07-11-18-54-00 +0000,wsj,"Latest Tariff Threats Could Delay Rate Cuts, Chicago Fed’s Goolsbee Says",https://www.wsj.com/economy/central-banking/latest-tariff-threats-could-delay-rate-cuts-chicago-feds-goolsbee-says-ff7e83a8
19,2025-07-11-10-00-00 +0000,latimes,"Arellano: 'La migra, la migra': Inside Huntington Park's long deportation summer",https://www.latimes.com/california/story/2025-07-11/huntington-park-deportations-history
19,2025-07-11-10-00-00 +0000,latimes,FBI investigating man who appeared to shoot at agents during Camarillo immigration raid,https://www.latimes.com/california/story/2025-07-11/fbi-investigating-shooting-camarillo-immigration-operation
19,2025-07-11-16-57-34 +0000,bbc,Mother mourns 'beautiful' 12-year-old shot while watching TV during Kenya protests,https://www.bbc.com/news/articles/cd6gzx85gdqo
19,2025-07-11-19-22-18 +0000,bbc,Trump threatens 35% tariffs on Canadian goods,https://www.bbc.com/news/articles/cvg819n954mo
19,2025-07-12-00-19-51 +0000,bbc,Trump surveys damage in Texas as search continues for 160 missing,https://www.bbc.com/news/articles/cr5vlp0pmdzo
18,2025-07-11-22-05-58 +0000,bbc,Donald Trump and the Scots: A not-so special relationship,https://www.bbc.com/news/articles/c78nv0y89p6o
18,2025-07-11-21-10-54 +0000,latimes,"Law enforcement violating rules on less-lethal weapons in ICE protests, critics say",https://www.latimes.com/california/story/2025-07-11/less-lethals-cause-lasting-physical-psychological-harm-critics-say
17,2025-07-11-17-37-00 +0000,wsj,"Nuclear power exemplifies how revamping dated and onerous rules could kick-start investment and innovation, writes the WSJ’s Greg Ip",https://www.wsj.com/economy/trumps-unsung-economic-booster-deregulation-e46bce0b
16,2025-07-12-01-17-02 +0000,latimes,"Father of three Marines beaten by masked federal agents, set to be released from immigration facility",https://www.latimes.com/california/story/2025-07-11/father-of-three-marines-beaten-by-federal-agents-set-to-be-released-from-immigration-facility
16,2025-07-11-16-24-19 +0000,bbc,Russians tell the BBC how they think the Ukraine war will end,https://www.bbc.com/news/videos/c1wp55wqq0lo
15,2025-07-12-01-37-57 +0000,latimes,Federal judge halts indiscriminate immigration stops in Los Angeles and beyond,https://www.latimes.com/california/story/2025-07-11/federal-judge-temporarily-halts-alleged-indiscriminate-immigration-stops
15,2025-07-12-01-06-54 +0000,latimes,Another conviction for 'American Nightmare' rapist Matthew Muller. Here's his latest crime,https://www.latimes.com/california/story/2025-07-11/another-conviction-for-american-nightmare-rapist-matthew-muller-heres-his-latest-crime
15,2025-07-12-01-12-57 +0000,bbc,'They were just kids': Mother mourns sons killed in Israeli strike while waiting for aid,https://www.bbc.com/news/articles/cy9xgrrq54go
15,2025-07-11-13-09-38 +0000,nyt,Kurdish PKK Fighters Burn Weapons in Step Toward Peace With Turkey,https://www.nytimes.com/2025/07/11/world/middleeast/pkk-turkey-conflict-arms-peace.html
15,2025-07-12-01-58-41 +0000,latimes,"Man sets California probation officer on fire during struggle, authorities say",https://www.latimes.com/california/story/2025-07-11/man-sets-california-probation-officer-on-fire-during-struggle-authorities-say
15,2025-07-11-10-00-00 +0000,latimes,Organizers hope the 2028 Summer Olympics present a 'refreshed global image of California',https://www.latimes.com/california/story/2025-07-11/2028-summer-olympics-tourism-planning
15,2025-07-11-10-00-00 +0000,latimes,Immigration raid at cannabis farm in Ventura County sparks chaotic protest,https://www.latimes.com/california/story/2025-07-11/ventura-county-immigration-raid
14,2025-07-11-23-44-53 +0000,latimes,Central Coast pot operation becomes site of massive immigration spectacle,https://www.latimes.com/california/story/2025-07-11/pot-farm-in-ventura-becomes-sight-of-massive-immigration-spectacle
14,2025-07-12-00-16-13 +0000,latimes,SoCal surgery center staff confront ICE agents detaining landscapers on the property,https://www.latimes.com/california/story/2025-07-11/california-surgery-center-staff-confront-ice-agents
14,2025-07-11-15-41-42 +0000,bbc,"Gaza's largest functioning hospital facing disaster, medics warn, as Israel widens offensive",https://www.bbc.com/news/articles/cdx5zeywgrgo
14,2025-07-11-14-27-19 +0000,bbc,Kurdish PKK burns guns in cauldron in big step towards ending Turkey conflict,https://www.bbc.com/news/articles/cyvj5v67ly9o
14,2025-07-11-10-00-00 +0000,latimes,How a Supreme Court win for public health bolstered RFK Jr. and threatens no-cost vaccines,https://www.latimes.com/politics/story/2025-07-11/supreme-court-ruling-bolsters-rfk-jr-threatens-no-cost-vaccines-and-other-health-screenings
14,2025-07-11-17-48-00 +0000,latimes,L.A. will provide cash assistance to immigrants affected by raids,https://www.latimes.com/california/story/2025-07-11/l-a-will-provide-cash-assistance-to-immigrants
13,2025-07-11-13-34-12 +0000,bbc,"Iran could recover some enriched uranium after US strikes, Israeli official says",https://www.bbc.com/news/articles/cn0qzxvydz1o
13,2025-07-11-14-17-33 +0000,nyt,"Some of Iran’s Enriched Uranium Survived Attacks, Israeli Official Says",https://www.nytimes.com/2025/07/10/us/politics/iran-attacks-damage.html
13,2025-07-11-13-07-16 +0000,nyt,"As Climate Change Heats Up Europe’s Summers, Avignon Festival Tries to Adapt",https://www.nytimes.com/2025/07/11/theater/avignon-festival-heat-climate-change.html
12,2025-07-11-10-00-00 +0000,latimes,A crisis of faith: ICE raids force some churches to take 'extraordinary' action,https://www.latimes.com/california/story/2025-07-11/la-me-church-sweeps-worship
12,2025-07-11-16-41-00 +0000,wsj,Canada Unemployment Rate Slips to 6.9% in June,https://www.wsj.com/economy/central-banking/canada-unemployment-rate-slips-to-6-9-in-june-ba2bbd79
12,2025-07-11-15-47-19 +0000,bbc,Watch: Moment child gets stuck inside a claw machine,https://www.bbc.com/news/videos/cy8kgg5l037o
12,2025-07-11-19-00-15 +0000,nyt,Police Investigate Burning of Migrant-Boat Effigy in Northern Ireland as a Hate Crime,https://www.nytimes.com/2025/07/11/world/europe/northern-ireland-bonfire-moygashel-migrant-boat.html
12,2025-07-11-21-58-42 +0000,latimes,Border Patrol agent charged with drunkenly attacking Long Beach cop while off duty,https://www.latimes.com/california/story/2025-07-11/cbp-charged-resisting-arrest-long-beach
12,2025-07-11-08-14-13 +0000,bbc,'I created it myself': The boy behind the viral 'aura farming' boat racing dance,https://www.bbc.com/news/articles/czxe7ey59r0o
11,2025-07-11-08-57-33 +0000,bbc,Watch: Child migrants' fears trying to cross the Channel,https://www.bbc.com/news/videos/c36x3k6y4zzo
11,2025-07-11-09-25-00 +0000,wsj,"ECB’s Bar for Another Rate Cut Is High, Schnabel Says",https://www.wsj.com/articles/ecbs-bar-for-another-rate-cut-is-high-schnabel-says-fe302495
11,2025-07-11-11-00-00 +0000,latimes,Shaikin: Dodger Stadium gondola closer to reality? Sacramento might help Team McCourt,https://www.latimes.com/sports/dodgers/story/2025-07-11/dodger-stadium-gondola-environmental-challenges-bill
11,2025-07-11-19-53-20 +0000,nyt,This Year’s Aix-en-Provence Festival Is Pierre Audi’s Last Act,https://www.nytimes.com/2025/07/11/arts/music/pierre-audi-aix-festival.html
11,2025-07-11-19-42-23 +0000,latimes,Federal judge orders LAPD to stop shooting journalists with rubber bullets at protests,https://www.latimes.com/california/story/2025-07-11/federal-judge-lapd-journalists-order
11,2025-07-11-18-22-44 +0000,nyt,Republicans Blame Canada for Wildfire Smoke ‘Suffocating’ the U.S.,https://www.nytimes.com/2025/07/11/world/canada/wildfire-smoke-manitoba-us-congress.html
10,2025-07-11-13-26-30 +0000,nyt,Manitoba Declares Second Wildfire Emergency in a Near-Record Year,https://www.nytimes.com/2025/07/11/world/canada/manitoba-wildfires-2025.html
10,2025-07-11-09-00-37 +0000,nyt,"In ‘Apocalypse in the Tropics,’ Director Petra Costa Examines Brazil’s Rightward Shift",https://www.nytimes.com/2025/07/11/movies/petra-costa-brazil-politics-documentary.html
10,2025-07-11-11-50-01 +0000,bbc,"War crimes being committed in Sudan, ICC believes",https://www.bbc.com/news/articles/cvg819yxkp5o
10,2025-07-11-18-56-19 +0000,nyt,Haiti’s Landmark Oloffson Hotel is Destroyed in an Apparent Arson Fire,https://www.nytimes.com/2025/07/07/world/americas/haiti-oloffson-hotel-fire-port-au-prince.html
10,2025-07-11-19-39-41 +0000,nyt,"Evidence Supports War Crimes Allegations in Darfur, I.C.C. Prosecutor Says",https://www.nytimes.com/2025/07/11/world/africa/sudan-darfur-war-crimes.html
10,2025-07-12-00-33-38 +0000,bbc,Intense Med Sea heatwave raises fears for marine life,https://www.bbc.com/news/articles/c4g2v1l7j6yo
10,2025-07-12-00-01-53 +0000,nyt,Heat Warnings Issued for Parts of Eastern Canada,https://www.nytimes.com/2025/07/11/weather/canada-heat-warnings.html
9,2025-07-12-00-39-24 +0000,bbc,North Korea's Benidorm-style resort welcomes first Russian tourists,https://www.bbc.com/news/articles/cwyrk588dlro
9,2025-07-11-22-40-54 +0000,bbc,An Indigenous Australian community is fighting to protect sacred springs from a coal mine,https://www.bbc.com/news/articles/ckglj211x9yo
9,2025-07-11-10-00-00 +0000,latimes,State officials say federal cuts threaten California's environment,https://www.latimes.com/environment/story/2025-07-11/fires-floods-and-forestlands-state-officials-alarmed-by-federal-threats-to-californias-environment
9,2025-07-11-17-28-33 +0000,nyt,"At Least 13 People Died by Suicide Amid U.K. Post Office Scandal, Report Says",https://www.nytimes.com/2025/07/10/world/europe/uk-post-office-scandal-report.html
9,2025-07-11-12-59-26 +0000,nyt,Meet the French Game Show Contestant Who Won 646 Times in a Row (and 23 Cars),https://www.nytimes.com/2025/07/11/arts/television/france-game-show.html
9,2025-07-11-11-55-51 +0000,bbc,Outrage builds over plan to force all Gazans to southern city,https://www.bbc.com/news/articles/c9dgv7v1d06o
9,2025-07-11-20-40-22 +0000,nyt,Son of El Chapo Pleads Guilty to Sweeping Drug Charges,https://www.nytimes.com/2025/07/11/us/politics/el-chapo-son-pleads-guilty.html
9,2025-07-11-21-11-54 +0000,bbc,US court rejects plea deal for '9/11 mastermind' Khalil Sheikh Mohammed,https://www.bbc.com/news/articles/c78nxqqp2leo
9,2025-07-11-15-20-00 +0000,latimes,"Contributor: Maybe the Epstein case isn't closed, but it's not going to be political dynamite",https://www.latimes.com/opinion/story/2025-07-11/trump-fbi-justice-department-jeffrey-epstein-client-list
9,2025-07-11-17-02-56 +0000,nyt,Netanyahu Ends Washington Trip Without a Gaza Truce,https://www.nytimes.com/2025/07/11/world/middleeast/netanyahu-washington-gaza-talks.html
9,2025-07-12-03-00-16 +0000,bbc,Federal judge says voice-over artists' AI lawsuit can move forward,https://www.bbc.com/news/articles/cedgzj8z1wjo
8,2025-07-12-04-20-41 +0000,bbc,"Gaza ceasefire talks on verge of collapse, Palestinian officials say",https://www.bbc.com/news/articles/cqjq9p87vdvo
8,2025-07-12-00-40-06 +0000,bbc,Is William Ruto the most disliked president in Kenya's history?,https://www.bbc.com/news/articles/c93kv37qdeno
8,2025-07-12-01-07-21 +0000,bbc,A bridge too far? Prague railway project draws criticism,https://www.bbc.com/news/articles/cvg8r0v05p8o
8,2025-07-11-16-04-05 +0000,bbc,Dozens taken to hospital after suspected mass overdose in Baltimore,https://www.bbc.com/news/articles/cp8m5jggjdgo
8,2025-07-12-00-07-28 +0000,bbc,The beauty and brutality of life in the shadow of Kashmir killings,https://www.bbc.com/news/articles/cjrll874eg5o
8,2025-07-11-22-56-21 +0000,nyt,"Maya Ruler’s Tomb Is Unearthed in Belize, With Clues to His Ancient World",https://www.nytimes.com/2025/07/10/world/americas/maya-tomb-caracol-belize.html
8,2025-07-11-22-53-15 +0000,bbc,Watch: Role of plane fuel switches explained,https://www.bbc.com/news/videos/cx2vrdd5xkeo
8,2025-07-11-11-05-06 +0000,nyt,Cairo Telecommunications Building Hit With 2nd Fire in a Week,https://www.nytimes.com/2025/07/11/world/middleeast/egypt-fire-cairo-telecom.html
7,2025-07-11-14-44-50 +0000,nyt,"Celebrating Humanity, Stubbornly, at Europe’s Photography Mecca",https://www.nytimes.com/2025/07/11/arts/design/arles-france-rencontres-de-la-photographie.html
7,2025-07-11-22-56-32 +0000,bbc,"US has resumed military supplies to Ukraine, Zelensky says",https://www.bbc.com/news/articles/crl04200dp4o
7,2025-07-12-04-01-07 +0000,nyt,How to Panic Italians? Jack Up the Price of Espresso.,https://www.nytimes.com/2025/07/12/world/europe/espresso-italy-coffee-prices.html
7,2025-07-12-02-59-22 +0000,bbc,Why cockpit audio deepens the mystery of Air India crash,https://www.bbc.com/news/articles/cx2gy78gpnqo
7,2025-07-11-22-28-20 +0000,bbc,Trade trumps geopolitics as Australia PM visits China,https://www.bbc.com/news/articles/c7vrjlp5zdvo
7,2025-07-11-13-41-02 +0000,bbc,More than 150 arrests in global human trafficking crackdown,https://www.bbc.com/news/articles/c36x3z1k18no
7,2025-07-11-17-45-57 +0000,nyt,Strava Fitness App Revealed Locations of Swedish Leaders,https://www.nytimes.com/2025/07/11/world/europe/strava-sweden-bodyguards-prime-minister.html
6,2025-07-11-22-34-55 +0000,nyt,"Brian Clarke, Stained-Glass Innovator, Is Dead at 71",https://www.nytimes.com/2025/07/11/arts/design/brian-clarke-dead.html
6,2025-07-11-15-53-00 +0000,wsj,"Week Ahead for FX, Bonds: U.S. Inflation Data in Focus",https://www.wsj.com/economy/week-ahead-for-fx-bonds-u-s-inflation-data-in-focus-44a8d97a
6,2025-07-11-15-02-15 +0000,nyt,"Srebrenica, a Massacre Foretold, Still Casts Its Shadow",https://www.nytimes.com/2025/07/11/world/europe/srebrenica-massacre-bosnia.html
5,2025-07-11-20-26-33 +0000,nyt,Want to Understand Russia? Visit Dubai.,https://www.nytimes.com/2025/07/11/world/europe/russia-dubai-iosif-prigozhin-putin.html
5,2025-07-11-11-17-26 +0000,bbc,Afghan cabbies' DIY solution to keep cool,https://www.bbc.com/news/videos/cgjgznve666o
5,2025-07-11-06-59-00 +0000,wsj,U.K. Economy Unexpectedly Slumps to Second Straight Month of Contraction,https://www.wsj.com/economy/global/u-k-economy-slumps-to-second-straight-month-of-contraction-40cb4c11
4,2025-07-11-14-39-27 +0000,nyt,20 Unforgettable Looks from Paris Couture Week,https://www.nytimes.com/2025/07/11/style/paris-couture-week-best-looks.html
4,2025-07-11-13-52-37 +0000,bbc,"Nigeria can't take Venezuelan deportees from US, minister says",https://www.bbc.com/news/articles/c23gz78v5jjo
