score,pubdate,source,title,link
37,2025-07-12-15-10-00 +0000,wsj,"The U.S. will charge a 30% tariff on the European Union and Mexico effective Aug. 1, President Trump said in letters to the leaders of each trading partner, posted on Truth Social",https://www.wsj.com/economy/trade/trump-threatens-30-tariffs-on-eu-mexico-c48ce36f
29,2025-07-11-19-40-14 +0000,nyt,Trump’s Latest Canada Tariff Threats Come Despite Cordial Negotiations With Carney,https://www.nytimes.com/2025/07/11/world/canada/canada-trump-tariffs-trade-talks.html
28,2025-07-12-14-00-00 +0000,wsj,The White House has an explanation for the nearly $2 trillion of manufacturing-related projects announced since the start of the year. It’s the Trump Effect.,https://www.wsj.com/politics/policy/trump-new-us-factories-d2981280
23,2025-07-11-23-05-58 +0000,bbc,Canada's Carney talked tough on Trump - now some say he's backing down,https://www.bbc.com/news/articles/cvg81518yyyo
23,2025-07-12-10-47-08 +0000,bbc,'Was this avoidable?': Families of Air India crash victims seek answers,https://www.bbc.com/news/articles/c5ylv04r1eyo
23,2025-07-12-13-00-50 +0000,nypost,Hochul asks Trump for power to disable nefarious drones — before it’s ‘too late’,https://nypost.com/2025/07/12/us-news/state-seeks-more-power-to-down-drones-before-its-too-late/
22,2025-07-12-15-44-01 +0000,bbc,Trump says EU and Mexico face 30% tariff from August,https://www.bbc.com/news/articles/cyvj13d9ylpo
22,2025-07-12-12-58-56 +0000,nypost,"George Soros funneled $37M to Working Families Party, other lefty groups backing Zohran Mamdani",https://nypost.com/2025/07/12/us-news/soros-funneled-37-million-to-lefty-groups-backing-mamdanis-mayoral-run/
22,2025-07-12-12-52-22 +0000,nypost,Foul! Mets logo ‘illegally’ co-opted to promote socialist Zohran Mamdani’s NYC mayoral bid,https://nypost.com/2025/07/12/us-news/foul-mets-logo-illegally-co-opted-to-boost-zohran-mamdani/
22,2025-07-12-12-53-00 +0000,nypost,Beautiful inside and out: Air Force vet who donated two organs poses for pin-up calendar,https://nypost.com/2025/07/12/us-news/air-force-vet-who-donated-two-organs-poses-for-pin-ups-for-vets-calendar/
21,2025-07-12-12-45-00 +0000,nypost,Furious NYC educators will stop funding UFT’s political arm to protest Mamdani endorsement,https://nypost.com/2025/07/12/us-news/uft-backing-zohran-mamdani-for-nyc-mayor-has-members-crying-foul/
21,2025-07-12-13-02-39 +0000,nypost,Trump announces 30% tariffs for Mexico and EU starting next month,https://nypost.com/2025/07/12/us-news/trump-announces-30-tariffs-for-mexico-and-eu-starting-next-month/
20,2025-07-12-06-04-07 +0000,bbc,"Air India report may lead to answers, but not closure for families",https://www.bbc.com/news/videos/c80pj0pv974o
19,2025-07-12-15-08-29 +0000,nypost,Everything we know about the female Secret Service agent in iconic ‘fight!’ Trump photo,https://nypost.com/2025/07/12/us-news/heres-what-we-know-about-the-female-agent-in-iconic-fight-trump-photo/
19,2025-07-12-08-35-29 +0000,bbc,What we know so far about Air India crash investigation,https://www.bbc.com/news/articles/c5y5nq170z4o
18,2025-07-12-13-26-21 +0000,nypost,Brooklyn DA rules on criminal charges against ‘King of All Pimps’ — who recruited Eliot Spitzer hooker Ashley Dupré,https://nypost.com/2025/07/12/us-news/king-of-all-pimps-who-recruited-then-ny-gov-eliot-spitzer-hooker-ashley-dupre-cleared-in-spat-with-youtuber/
18,2025-07-12-15-29-35 +0000,nypost,NYC Councilman and Central Park 5 figure Yusuf Salaam owes six figures in taxes — despite big money from speaking fees,https://nypost.com/2025/07/12/us-news/yusuf-salaam-owes-six-figures-in-taxes-despite-speaking-fees/
18,2025-07-12-01-53-00 +0000,wsj,A dispute over the Federal Reserve’s renovation of its headquarters could provide the pretext to attempt the removal of Fed chief Jerome Powell over interest-rate disagreements,https://www.wsj.com/economy/central-banking/jerome-powell-fed-renovations-trump-fb9793df
18,2025-07-12-02-59-22 +0000,bbc,Why cockpit audio deepens the mystery of Air India crash,https://www.bbc.com/news/articles/cx2gy78gpnqo
18,2025-07-11-17-37-00 +0000,wsj,"Nuclear power exemplifies how revamping dated and onerous rules could kick-start investment and innovation, writes the WSJ’s Greg Ip",https://www.wsj.com/economy/trumps-unsung-economic-booster-deregulation-e46bce0b
18,2025-07-11-21-44-35 +0000,nyt,How El Salvador Is Reaping Rewards From Trump’s Deportation Agenda,https://www.nytimes.com/2025/07/10/world/americas/trump-migrants-el-salvador-bukele.html
17,2025-07-11-18-54-00 +0000,wsj,"Latest Tariff Threats Could Delay Rate Cuts, Chicago Fed’s Goolsbee Says",https://www.wsj.com/economy/central-banking/latest-tariff-threats-could-delay-rate-cuts-chicago-feds-goolsbee-says-ff7e83a8
17,2025-07-11-19-22-18 +0000,bbc,Trump threatens 35% tariffs on Canadian goods,https://www.bbc.com/news/articles/cvg819n954mo
17,2025-07-12-14-48-50 +0000,nypost,‘Jews for Zohran’ Mamdani group tied to niece of lefty China-based billionaire,https://nypost.com/2025/07/12/us-news/jews-for-zohran-mamdani-group-tied-to-niece-of-lefty-china-based-billionaire/
17,2025-07-11-22-05-58 +0000,bbc,Donald Trump and the Scots: A not-so special relationship,https://www.bbc.com/news/articles/c78nv0y89p6o
17,2025-07-12-13-08-23 +0000,nypost,"Exploding Nutribullet left NYC man with severed artery, ‘trauma that will last a lifetime’: lawsuit",https://nypost.com/2025/07/12/us-news/exploding-nutribullet-left-nyc-man-with-severed-artery-lawsuit/
16,2025-07-12-14-24-32 +0000,nypost,"Court throws out plea deal for 9/11 mastermind Khalid Sheikh Mohammed, two other terrorists",https://nypost.com/2025/07/12/us-news/court-throws-out-plea-deal-for-9-11-mastermind-khalid-sheikh-mohammed-two-other-terrorists/
16,2025-07-11-16-57-34 +0000,bbc,Mother mourns 'beautiful' 12-year-old shot while watching TV during Kenya protests,https://www.bbc.com/news/articles/cd6gzx85gdqo
16,2025-07-11-22-53-15 +0000,bbc,Watch: What we know about the fuel switches on Air India flight 171,https://www.bbc.com/news/videos/cx2vrdd5xkeo
15,2025-07-12-01-12-57 +0000,bbc,'They were just kids': Mother mourns sons killed in Israeli strike while waiting for aid,https://www.bbc.com/news/articles/cy9xgrrq54go
15,2025-07-12-13-40-08 +0000,nypost,FEMA removed dozens of Camp Mystic buildings from 100-year flood map before expansion: records,https://nypost.com/2025/07/12/us-news/fema-removed-dozens-of-camp-mystic-buildings-from-100-year-flood-map-before-expansion-records/
15,2025-07-12-14-00-00 +0000,nypost,Christians United for Israel offers support where others fail: ‘Won’t let Jewish people suffer on our watch!’,https://nypost.com/2025/07/12/us-news/christians-united-for-israel-offers-support-where-many-fail/
14,2025-07-12-14-44-37 +0000,nypost,Felix the Cat heirs claim they were cut out of $100M in business from popular cartoon feline,https://nypost.com/2025/07/12/us-news/felix-the-cat-heirs-claim-they-were-cut-out-of-100-million-lawsuit/
13,2025-07-11-16-24-19 +0000,bbc,Russians tell the BBC how they think the Ukraine war will end,https://www.bbc.com/news/videos/c1wp55wqq0lo
12,2025-07-12-15-18-07 +0000,nypost,Prominent Georgia Republican Brant Frost IV apologizes for $140M Ponzi scheme as judge freezes assets,https://nypost.com/2025/07/12/us-news/georgia-republican-brant-frost-iv-apologizes-for-140m-ponzi-scheme-as-judge-freezes-assets/
12,2025-07-12-09-30-00 +0000,wsj,Pittsburgh is striving to turn its old steel mills into a high-tech center to help reverse economic decline,https://www.wsj.com/tech/ai/can-pittsburghs-old-steel-mills-be-turned-into-an-ai-hub-bb2dd8ff
11,2025-07-12-12-30-00 +0000,nypost,Serial NYC shoplifter waltzes free despite staggering 254 arrests,https://nypost.com/2025/07/12/us-news/shoplifting-up-nearly-90-from-five-years-ago-cops-said/
11,2025-07-12-14-34-23 +0000,bbc,"Israeli settlers kill Palestinians in West Bank attack, health ministry says",https://www.bbc.com/news/articles/cm2mknzn99eo
11,2025-07-11-16-41-00 +0000,wsj,Canada Unemployment Rate Slips to 6.9% in June,https://www.wsj.com/economy/central-banking/canada-unemployment-rate-slips-to-6-9-in-june-ba2bbd79
10,2025-07-12-00-40-06 +0000,bbc,Is William Ruto the most disliked president in Kenya's history?,https://www.bbc.com/news/articles/c93kv37qdeno
10,2025-07-12-01-07-21 +0000,bbc,A bridge too far? Prague railway project draws criticism,https://www.bbc.com/news/articles/cvg8r0v05p8o
10,2025-07-12-05-19-04 +0000,bbc,Al Fayed family battle over luxury penthouse with 'leaky roofs and noisy lifts',https://www.bbc.com/news/articles/c0m8pew4331o
10,2025-07-11-18-22-44 +0000,nyt,Republicans Blame Canada for Wildfire Smoke ‘Suffocating’ the U.S.,https://www.nytimes.com/2025/07/11/world/canada/wildfire-smoke-manitoba-us-congress.html
10,2025-07-11-20-40-22 +0000,nyt,Son of El Chapo Pleads Guilty to Sweeping Drug Charges,https://www.nytimes.com/2025/07/11/us/politics/el-chapo-son-pleads-guilty.html
10,2025-07-12-00-33-38 +0000,bbc,Med Sea heatwave might feel nice for holiday swimming but there's a catch,https://www.bbc.com/news/articles/c4g2v1l7j6yo
10,2025-07-12-00-01-53 +0000,nyt,Heat Warnings Issued for Parts of Eastern Canada,https://www.nytimes.com/2025/07/11/weather/canada-heat-warnings.html
9,2025-07-12-12-54-06 +0000,nypost,State of arousal: Do you live in the most perverted place in America?,https://nypost.com/2025/07/12/us-news/do-you-live-in-the-most-perverted-state-in-america-find-out-now/
9,2025-07-12-13-44-16 +0000,nypost,Not very neighborly: Nearly 60% of Canadians see the US as their biggest threat,https://nypost.com/2025/07/12/world-news/nearly-60-of-canadians-see-us-as-nations-biggest-threat/
9,2025-07-12-14-36-38 +0000,nypost,One of the world’s priciest parking spots is located in Brooklyn,https://nypost.com/2025/07/12/us-news/park-slope-parking-spot-sells-for-close-to-250000/
9,2025-07-11-18-56-19 +0000,nyt,Haiti’s Landmark Oloffson Hotel is Destroyed in an Apparent Arson Fire,https://www.nytimes.com/2025/07/07/world/americas/haiti-oloffson-hotel-fire-port-au-prince.html
9,2025-07-11-22-40-54 +0000,bbc,An Indigenous Australian community is fighting to protect sacred springs from a coal mine,https://www.bbc.com/news/articles/ckglj211x9yo
9,2025-07-12-00-39-24 +0000,bbc,North Korea's Benidorm-style resort welcomes first Russian tourists,https://www.bbc.com/news/articles/cwyrk588dlro
9,2025-07-11-22-28-20 +0000,bbc,Trade trumps geopolitics as Australia PM visits China,https://www.bbc.com/news/articles/c7vrjlp5zdvo
9,2025-07-11-22-56-21 +0000,nyt,"Maya Ruler’s Tomb Is Unearthed in Belize, With Clues to His Ancient World",https://www.nytimes.com/2025/07/10/world/americas/maya-tomb-caracol-belize.html
8,2025-07-11-19-39-41 +0000,nyt,"Evidence Supports War Crimes Allegations in Darfur, I.C.C. Prosecutor Says",https://www.nytimes.com/2025/07/11/world/africa/sudan-darfur-war-crimes.html
7,2025-07-12-13-20-04 +0000,bbc,"Arizona resident dies from plague, health officials say",https://www.bbc.com/news/articles/cz7l8w8881qo
7,2025-07-12-10-00-09 +0000,nyt,A Beloved Canadian Chocolate Bar Disappears From the Market,https://www.nytimes.com/2025/07/12/world/canada/neilson-jersey-milk-discontinued.html
7,2025-07-12-11-20-48 +0000,bbc,German backpacker found after 11 nights in Australia's outback,https://www.bbc.com/news/articles/c17w87pv5ljo
7,2025-07-12-12-05-10 +0000,bbc,"Man, 25, dies in balcony fall at Malta hotel",https://www.bbc.com/news/articles/cd97vxx8nw4o
6,2025-07-12-10-00-00 +0000,latimes,ICE raids are leaving some L.A. cats and dogs homeless,https://www.latimes.com/environment/story/2025-07-12/ice-raids-deported-los-angeles-cats-and-dogs-left-behind
6,2025-07-12-04-20-41 +0000,bbc,"Gaza ceasefire talks on verge of collapse, Palestinian officials say",https://www.bbc.com/news/articles/cqjq9p87vdvo
6,2025-07-11-22-56-32 +0000,bbc,"US has resumed military supplies to Ukraine, Zelensky says",https://www.bbc.com/news/articles/crl04200dp4o
6,2025-07-12-00-05-51 +0000,bbc,Faisal Islam: We are heading for significant tax rises,https://www.bbc.com/news/articles/c9dgn647nplo
6,2025-07-12-00-07-28 +0000,bbc,The beauty and brutality of life in the shadow of Kashmir killings,https://www.bbc.com/news/articles/cjrll874eg5o
5,2025-07-11-16-03-33 +0000,bbc,Martin Lewis' trick for haggling with a call centre,https://www.bbc.com/news/videos/cn7d11z53jxo
