pubdate,source,title,link
2025-07-11-09-51-33 +0000,bbc,"Texans did not immediately receive flood alerts after request, audio reveals",https://www.bbc.com/news/articles/cq537dp2ello
2025-07-11-09-44-24 +0000,bbc,US cuts visa validity for applicants from four African countries,https://www.bbc.com/news/articles/cx23ywg9w82o
2025-07-11-09-44-11 +0000,nyt,Meet the French Game Show Contestant Who Won 646 Times in a Row (and 23 Cars),https://www.nytimes.com/2025/07/11/arts/television/france-game-show.html
2025-07-11-09-30-00 +0000,wsj,"Nuclear power exemplifies how revamping dated and onerous rules could kick-start investment and innovation, writes the WSJ’s Greg Ip",https://www.wsj.com/economy/trumps-unsung-economic-booster-deregulation-e46bce0b
2025-07-11-09-26-43 +0000,bbc,MP Rupert Lowe investigated by standards watchdog,https://www.bbc.com/news/articles/ceq7z421pwzo
2025-07-11-09-25-00 +0000,wsj,"ECB’s Bar for Another Rate Cut Is High, Schnabel Says",https://www.wsj.com/articles/ecbs-bar-for-another-rate-cut-is-high-schnabel-says-fe302495
2025-07-11-09-01-57 +0000,nyt,Behind Trump’s Decision to Tax Brazil to Save Bolsonaro,https://www.nytimes.com/2025/07/11/world/americas/brazil-trump-tariffs.html
2025-07-11-09-01-21 +0000,nyt,How This River in Thailand Was Poisoned,https://www.nytimes.com/video/world/asia/100000010272461/thailand-kok-river-myanmar-rare-earths-explained.html
2025-07-11-09-01-03 +0000,bbc,Mystery interstellar object could be oldest known comet,https://www.bbc.com/news/articles/cx23g5jpj9go
2025-07-11-09-00-36 +0000,nyt,"In ‘Apocalypse in the Tropics,’ Director Petra Costa Examines Brazil’s Rightward Shift",https://www.nytimes.com/2025/07/11/movies/petra-cotsa-brazil-politics-documentary.html
2025-07-11-08-57-33 +0000,bbc,Watch: Child migrants' fears trying to cross the Channel,https://www.bbc.com/news/videos/c36x3k6y4zzo
2025-07-11-08-57-06 +0000,bbc,"Nigeria has 'enough problems' and can't take deportees from US, minister says",https://www.bbc.com/news/articles/c23gz78v5jjo
2025-07-11-08-57-04 +0000,bbc,What is an Isa and how might the rules change?,https://www.bbc.com/news/articles/c0k7enxkxndo
2025-07-11-08-48-20 +0000,bbc,Reeves disappointed after economy unexpectedly shrinks,https://www.bbc.com/news/articles/cq6mvem8neno
2025-07-11-08-46-14 +0000,nyt,Rubio and Chinese Diplomat Vie for Influence in Asia Over Trump’s Tariffs,https://www.nytimes.com/2025/07/11/us/politics/china-us-asia-tariffs.html
2025-07-11-08-28-20 +0000,bbc,Plans for cash Isa changes on hold after backlash,https://www.bbc.com/news/articles/cqjq9yxkkrvo
2025-07-11-08-27-14 +0000,nyt,Manitoba Declares Second Wildfire Emergency in a Near-Record Year,https://www.nytimes.com/2025/07/11/world/americas/manitoba-wildfires-2025.html
2025-07-11-08-23-15 +0000,bbc,Heathrow aims to add 10m annual passengers by 2031,https://www.bbc.com/news/articles/c4gdj2epe04o
2025-07-11-08-14-13 +0000,bbc,'I created it myself': The boy behind the viral 'aura farming' boat racing dance,https://www.bbc.com/news/articles/czxe7ey59r0o
2025-07-11-08-06-08 +0000,bbc,"UK-France migrant deal 'robust' against legal challenges, Cooper says",https://www.bbc.com/news/articles/cx24d70gw41o
2025-07-11-07-00-59 +0000,bbc,Kurdish PKK to lay down arms in big step towards ending Turkey conflict,https://www.bbc.com/news/articles/cyvj5v67ly9o
2025-07-11-06-59-00 +0000,wsj,U.K. Economy Unexpectedly Slumps to Second Straight Month of Contraction,https://www.wsj.com/economy/global/u-k-economy-slumps-to-second-straight-month-of-contraction-40cb4c11
2025-07-11-05-43-45 +0000,bbc,Justin Bieber stands on business with surprise new album,https://www.bbc.com/news/articles/ce8zwz0jp17o
2025-07-11-05-26-43 +0000,nyt,What to Know About the Rare Earths Mining Boom in Myanmar,https://www.nytimes.com/2025/07/11/world/asia/rare-earths-boom-myanmar.html
2025-07-11-05-25-20 +0000,nyt,Rare Earths Mining in Myanmar Is Polluting Thailand’s Kok River,https://www.nytimes.com/2025/07/11/world/asia/myanmar-mining-thailand-china.html
2025-07-11-05-15-20 +0000,bbc,"Never seen that lady in my life, pupils say of FM",https://www.bbc.com/news/articles/c5y02pdzk0no
2025-07-11-05-00-27 +0000,bbc,Starmer and Macron plead for patience in an impatient world,https://www.bbc.com/news/articles/clynxqdr157o
2025-07-11-05-00-11 +0000,nyt,"Friday Briefing: Iran Has Some Uranium Left, Israel Says",https://www.nytimes.com/2025/07/11/briefing/iran-enriched-uranium-israel-ukraine-spy-france-britain-defense.html
2025-07-11-04-36-27 +0000,bbc,Trump threatens 35% tariffs on Canadian goods,https://www.bbc.com/news/articles/cvg819n954mo
2025-07-11-04-00-23 +0000,nyt,The Mystery of Trump’s 25% Tariff Threat on Kazakhstan,https://www.nytimes.com/2025/07/11/business/trump-tariffs-kazakhstan.html
2025-07-11-03-34-23 +0000,bbc,"War crimes being committed in Sudan, ICC believes",https://www.bbc.com/news/articles/cvg819yxkp5o
2025-07-11-02-39-47 +0000,bbc,Watch: Smoke billows from luxury yacht fire in St Tropez,https://www.bbc.com/news/videos/c4g85005q93o
2025-07-11-01-50-02 +0000,bbc,Judge blocks Trump's birthright order after Supreme Court ruling,https://www.bbc.com/news/articles/c0l4jw5glplo
2025-07-11-00-45-05 +0000,bbc,Asia is reeling from Trump's tariff salvo – is anyone winning?,https://www.bbc.com/news/articles/ckg5l2yy42eo
2025-07-11-00-27-06 +0000,bbc,'We're worried about our future': Srebrenica massacre's tensions still felt 30 years on,https://www.bbc.com/news/articles/c4g2edzg2wlo
2025-07-10-23-38-25 +0000,bbc,Is there a secret formula for election-winning slogans?,https://www.bbc.com/news/articles/cjel1wlq7vdo
2025-07-10-23-33-41 +0000,nyt,"At Least 13 People Died by Suicide Amid U.K. Post Office Scandal, Report Says",https://www.nytimes.com/2025/07/10/world/europe/uk-post-office-scandal-report.html
2025-07-10-23-33-34 +0000,bbc,Row over language turns violent in India's richest state,https://www.bbc.com/news/articles/c93kwqvw3jxo
2025-07-10-23-29-11 +0000,nyt,3 Teenagers Arrested Over Cyberattacks That Cost U.K. Retailers Millions,https://www.nytimes.com/2025/07/10/business/cyber-attack-arrests-marks-spencers-harrods-coop.html
2025-07-10-23-23-47 +0000,bbc,Mahmoud Khalil files $20m claim against Trump administration,https://www.bbc.com/news/articles/cvg4188gl4zo
2025-07-10-23-11-30 +0000,nyt,China Surveys Seabeds Where Naval Rivals May One Day Clash,https://www.nytimes.com/2025/07/10/world/asia/china-ships-taiwan-guam.html
2025-07-10-23-05-30 +0000,bbc,"'Autofocus' specs promise sharp vision, near or far",https://www.bbc.com/news/articles/cj6r06d7xdjo
2025-07-10-22-59-09 +0000,bbc,"In the country with the world's lowest birth rate, fertility clinics are booming",https://www.bbc.com/news/articles/c20wg50l563o
2025-07-10-22-45-28 +0000,bbc,Secret Service suspended staff for failings in Trump assassination attempt,https://www.bbc.com/news/articles/cy0w9ev559ro
2025-07-10-22-00-03 +0000,bbc,"UK to return some migrants to France within weeks, PM says",https://www.bbc.com/news/articles/c4g2edx410wo
2025-07-10-21-51-24 +0000,bbc,Canadian premier accuses US lawmakers of 'trying to trivialise' wildfires,https://www.bbc.com/news/articles/cvg9jrxvjpjo
2025-07-10-21-51-06 +0000,nyt,"Coal, the Last Survivor of Canada’s Parliament Hill Cat Colony, Dies",https://www.nytimes.com/2025/07/10/world/canada/canada-parliament-cat-colony-dead.html
2025-07-10-21-44-33 +0000,bbc,Nigeria win to book spot in Wafcon quarter-finals,https://www.bbc.com/sport/football/articles/cg75ylvjm8zo
2025-07-10-21-27-33 +0000,nyt,U.K. and France Sign First Nuclear Pact to Fend Off Threat to Europe,https://www.nytimes.com/2025/07/10/world/europe/starmer-macron-nuclear-agreement.html
2025-07-10-21-23-16 +0000,nyt,Friday Briefing: Israel Says Iran Has Some Uranium Left,https://www.nytimes.com/2025/07/10/briefing/iran-nuclear-program-ukraine-intelligence-killing-france-britain.html
2025-07-10-21-23-05 +0000,nyt,"U.K. Faces Rising Threat From Iranian Plots, Intelligence Committee Says",https://www.nytimes.com/2025/07/10/world/europe/uk-iran-espionage-threats.html
2025-07-10-21-09-56 +0000,bbc,"Children queuing for supplements killed in Israeli strike in Gaza, hospital says",https://www.bbc.com/news/articles/c4gd01g1gxro
2025-07-10-21-05-58 +0000,bbc,Rosenberg: Putin determined to press on despite threat of tougher sanctions,https://www.bbc.com/news/videos/cz9kqe5v379o
2025-07-10-20-34-34 +0000,nyt,Ukrainian Intelligence Officer Is Shot to Death in Kyiv,https://www.nytimes.com/2025/07/10/world/europe/ukraine-intelligence-officer-shooting-sbu.html
2025-07-10-20-22-01 +0000,nyt,US-Brazil Tariffs: What to Know About Trump’s History With Bolsonaro,https://www.nytimes.com/2025/07/10/world/americas/trump-bolsonaro-brazil-tariffs.html
2025-07-10-20-10-28 +0000,nyt,"Targeting Brazil, Trump Tests Legal Limit of His Tariff Powers",https://www.nytimes.com/2025/07/10/us/politics/trump-brazil-tariffs-legal-limit.html
2025-07-10-19-57-35 +0000,nyt,"‘Ne Zha 2,’ Blockbuster Chinese Animated Film, Will Get English Version",https://www.nytimes.com/2025/07/09/movies/ne-zha-2-english-us-theaters.html
2025-07-10-19-54-38 +0000,bbc,Councillor calls man-made global warming a 'hoax',https://www.bbc.com/news/articles/c0j458q00e2o
2025-07-10-19-45-28 +0000,bbc,Watch: Rare shelf cloud seen over Maryland amid severe weather,https://www.bbc.com/news/videos/cwyg93lzqd7o
2025-07-10-19-30-10 +0000,bbc,'I can't drink the water' - life next to a US data centre,https://www.bbc.com/news/articles/cy8gy7lv448o
2025-07-10-19-29-28 +0000,bbc,Watch: The story of Jane Birkin's £7.4m handbag,https://www.bbc.com/news/videos/c24vdnp37d1o
2025-07-10-19-21-49 +0000,nyt,Rubio Tells Top Russian Diplomat of Trump’s Frustration Over Putin’s War,https://www.nytimes.com/2025/07/09/world/asia/rubio-asia-diplomacy-tariffs.html
2025-07-10-18-40-28 +0000,nyt,Russia Bombards Ukraine as U.S. Frustration Mounts,https://www.nytimes.com/2025/07/10/world/europe/ukraine-russia-lavrov-rubio.html
2025-07-10-18-37-50 +0000,nyt,European Union Unveils Rules for Powerful A.I. Systems,https://www.nytimes.com/2025/07/10/business/ai-rules-europe.html
2025-07-10-18-25-16 +0000,bbc,When to book and where to stay: Six ways to save money on your summer holiday,https://www.bbc.com/news/articles/cq6mvn699v9o
2025-07-10-18-22-03 +0000,nyt,"Israel Will Allow More Aid Into Gaza, Officials Say",https://www.nytimes.com/2025/07/10/world/middleeast/israel-gaza-aid.html
2025-07-10-18-19-52 +0000,bbc,Why is Trump targeting Brazil - and will it backfire for Bolsonaro?,https://www.bbc.com/news/articles/crk68drj57mo
2025-07-10-18-00-31 +0000,bbc,"'One in, one out' sounds simple - but the migrant deal could be complicated",https://www.bbc.com/news/articles/c8d60djgqndo
2025-07-10-18-00-07 +0000,nyt,This Jungle Plant Is a Good Landlord to Its Tenant Ants,https://www.nytimes.com/2025/07/10/science/ants-plant-fiji.html
2025-07-10-17-33-17 +0000,bbc,Six things Trump should know about Liberia after he praised leader's 'good English',https://www.bbc.com/news/articles/c5y72w17vpwo
2025-07-10-17-17-07 +0000,nyt,UK Braces for Record Temperatures as Third Heat Wave Spreads,https://www.nytimes.com/2025/07/10/weather/uk-heat-wave.html
2025-07-10-16-52-48 +0000,bbc,Investigation into bans for Grenfell firms paused,https://www.bbc.com/news/articles/cq537ey5ggjo
2025-07-10-16-43-05 +0000,bbc,"UK faces rising and unpredictable threat from Iran, report warns",https://www.bbc.com/news/articles/c98wjzj4jlpo
2025-07-10-16-38-20 +0000,bbc,Original Birkin bag shatters record with £7m sale,https://www.bbc.com/news/articles/cly8zvexp42o
2025-07-10-16-27-08 +0000,nyt,"England’s Sycamore Gap Tree, Felled by Vandals, Stands Again as Art",https://www.nytimes.com/2025/07/10/world/europe/sycamore-gap-tree-memorial.html
2025-07-10-16-25-50 +0000,nyt,La Scala Warns Opera Patrons: No Flip-Flops or Tank Tops Allowed,https://www.nytimes.com/2025/07/10/arts/la-scala-opera-dress-code.html
2025-07-10-16-08-00 +0000,wsj,"Businesses hoping for clarity on where Trump tariffs land will likely have to wait a bit longer. For now, here’s where things stand.",https://www.wsj.com/economy/trade/trump-tariffs-countries-goods-explained-b9878e1a
2025-07-10-15-36-13 +0000,bbc,Emergency crews rescue 31 after Los Angeles tunnel collapse,https://www.bbc.com/news/videos/clynx3qzx3xo
2025-07-10-15-12-26 +0000,nyt,How El Salvador Is Reaping Rewards From Trump’s Deportation Agenda,https://www.nytimes.com/2025/07/10/world/americas/trump-migrants-el-salvador-bukele.html
2025-07-10-14-42-38 +0000,nyt,Trump Seems to Be Warming to What Europe Wants for Ukraine: New Russia Sanctions,https://www.nytimes.com/2025/07/10/world/europe/trump-ukraine-russia-europe.html
2025-07-10-14-38-00 +0000,bbc,The Briefing Room,https://www.bbc.co.uk/sounds/play/m002fljj
2025-07-10-14-13-08 +0000,nyt,"As Israel and Ukraine Advance Drone Warfare, U.S. Sees Its Own Vulnerabilities",https://www.nytimes.com/2025/07/10/us/politics/us-military-drone-technology.html
2025-07-10-14-13-03 +0000,bbc,Ex-Tory chairman Jake Berry defects to Reform UK,https://www.bbc.com/news/articles/cx24lll3n99o
2025-07-10-14-08-56 +0000,bbc,Lara said I should have broken his record - Mulder,https://www.bbc.com/sport/cricket/articles/cn0zelr9kjzo
2025-07-10-14-05-42 +0000,bbc,Ferrero to take over US breakfast cereal giant Kellogg,https://www.bbc.com/news/articles/c3d1m2kjk93o
2025-07-10-13-48-19 +0000,bbc,"It's too easy to claim benefits in UK, Badenoch says",https://www.bbc.com/news/articles/c80p1gdvyggo
2025-07-10-13-42-24 +0000,bbc,Four arrested in connection with M&S and Co-op cyber-attacks,https://www.bbc.com/news/articles/cwykgrv374eo
2025-07-10-13-37-25 +0000,bbc,Cost of living payment brought forward for 2025,https://www.bbc.com/news/articles/clymgyvm0edo
2025-07-10-13-01-26 +0000,bbc,EU chief von der Leyen survives rare confidence vote,https://www.bbc.com/news/articles/cm2zym677j2o
2025-07-10-12-53-00 +0000,wsj,U.S. Jobless Claims Fell Last Week,https://www.wsj.com/economy/jobs/u-s-jobless-claims-fell-last-week-fb0df0b3
2025-07-10-12-50-49 +0000,nyt,K-Pop Singer Taeil Sentenced to 3½-Years in Rape of Tourist,https://www.nytimes.com/2025/07/10/world/asia/kpop-taeil-sentenced-sex-crime.html
2025-07-10-12-35-57 +0000,bbc,US government to invest in rare earths production,https://www.bbc.com/news/articles/c3r91rngq2do
2025-07-10-12-29-10 +0000,nyt,"Maya Ruler’s Tomb Is Unearthed in Belize, With Clues to His Ancient World",https://www.nytimes.com/2025/07/10/world/americas/maya-tomb-caracol-belize.html
2025-07-10-12-20-09 +0000,nyt,A British Surgeon Shares What She Saw in Gaza’s Hospitals,https://www.nytimes.com/2025/07/09/world/middleeast/gaza-hospitals-uk-surgeon-israel-attacks.html
2025-07-10-12-18-58 +0000,nyt,The Calgary Stampede Captures Canada’s Western Spirit,https://www.nytimes.com/2025/07/10/world/canada/calgary-stampede-rodeo.html
2025-07-10-12-04-11 +0000,nyt,"Trump Pledges 50% Tariffs Against Brazil, Citing ‘Witch Hunt’ Against Bolsonaro",https://www.nytimes.com/2025/07/09/world/americas/brazil-trump-bolsonaro-lula-coup-tariff.html
2025-07-10-11-57-03 +0000,bbc,Macron jokes about Larry the cat with Starmer and Reeves,https://www.bbc.com/news/videos/cy4yg47jkrjo
2025-07-10-11-30-07 +0000,bbc,Brazil vows to match US tariffs after Trump threatens 50% levy,https://www.bbc.com/news/articles/c62dvyv60z7o
2025-07-10-11-30-00 +0000,bbc,The Bottom Line,https://www.bbc.co.uk/sounds/play/m002flj2
2025-07-10-11-26-04 +0000,bbc,"Open up places with air-con to help in heatwave, say Lib Dems",https://www.bbc.com/news/articles/c20r53ex631o
2025-07-10-11-18-59 +0000,nyt,Denmark Aims to Use Copyright Law to Protect People From Deepfakes,https://www.nytimes.com/2025/07/10/world/europe/denmark-deepfake-copyright-ai-law.html
2025-07-10-11-14-00 +0000,wsj,Irish Factory Output Rebounds as Exports to U.S. Rise,https://www.wsj.com/economy/irish-factory-output-rebounds-as-exports-to-u-s-rise-e2549d64
2025-07-10-11-09-28 +0000,bbc,Back-to-back floods in New Mexico and Texas with very different outcomes,https://www.bbc.com/news/articles/c5y022wp009o
2025-07-10-10-35-13 +0000,bbc,Royal Mail to scrap second-class post on Saturdays,https://www.bbc.com/news/articles/c36x8k2612ko
2025-07-10-10-31-09 +0000,bbc,Semenya's right to a fair hearing violated - ECHR,https://www.bbc.com/sport/olympics/articles/c7vr04v3vpdo
2025-07-10-10-14-50 +0000,nyt,Southern China and Hong Kong Brace for Floods and Fierce Winds from Danas,https://www.nytimes.com/2025/07/10/world/asia/typhoon-danas-rain-flooding-china-hong-kong.html
2025-07-10-10-06-57 +0000,bbc,South Africans fear spike in HIV infections as US aid cuts bite,https://www.bbc.com/news/articles/ce83r14vlnpo
