pubdate,source,title,link
2025-07-12-06-46-43 +0000,nyt,Air India Plane Crash Report Says Fuel to Engines Was Cut Off,https://www.nytimes.com/2025/07/11/world/asia/air-india-crash-report.html
2025-07-12-06-10-09 +0000,nypost,Kentucky school official resigns after allegedly calling to ‘shoot Republicans’ on social media,https://nypost.com/2025/07/12/us-news/kentucky-school-district-chairman-jeffrey-miller-resigns-after-social-media-post-calling-to-shoot-republicans/
2025-07-12-05-55-04 +0000,startribune,Joe Ryan starts Minnesota Twins toward 2-1 victory over Pittsburgh Pirates and Paul Skenes,https://www.startribune.com/minnesota-twins-pittsburgh-pirates-carlos-correa-joe-ryan-paul-skenes/601420579
2025-07-12-04-51-59 +0000,nypost,Beloved ‘Wheelchair Waver’ critically injured by alleged drunk driver — decades after similar tragedy left him disabled,https://nypost.com/2025/07/12/us-news/wheelchair-waver-struck-by-alleged-drunk-driver-decades-after-similar-tragedy-left-him-disabled/
2025-07-12-04-50-49 +0000,nypost,"Alleged Florida child rapist lured girl, 11, into park bathroom before being chased down and captured by good Samaritans",https://nypost.com/2025/07/12/us-news/alleged-florida-child-rape-suspect-antwan-johnson-chased-down-caught-by-good-samaritans-in-miami-park/
2025-07-12-04-20-41 +0000,bbc,"Gaza ceasefire talks on verge of collapse, Palestinian officials say",https://www.bbc.com/news/articles/cqjq9p87vdvo
2025-07-12-04-15-53 +0000,nypost,Florida ‘Nail Bandit’ accused of sabotaging fire rescue vehicles with sharp objects over ‘beef’ with department,https://nypost.com/2025/07/12/us-news/florida-nail-bandit-accused-of-sabotaging-fire-rescue-vehicles-with-sharp-objects/
2025-07-12-04-01-13 +0000,nyt,"When It’s This Hot, ‘We Are Enduring, Not Living’",https://www.nytimes.com/2025/07/12/world/asia/pakistan-heat.html
2025-07-12-04-01-07 +0000,nyt,How to Panic Italians? Jack Up the Price of Espresso.,https://www.nytimes.com/2025/07/12/world/europe/espresso-italy-coffee-prices.html
2025-07-12-03-00-16 +0000,bbc,Federal judge says voice-over artists' AI lawsuit can move forward,https://www.bbc.com/news/articles/cedgzj8z1wjo
2025-07-12-02-59-22 +0000,bbc,Why cockpit audio deepens the mystery of Air India crash,https://www.bbc.com/news/articles/cx2gy78gpnqo
2025-07-12-02-56-04 +0000,nypost,LA Mayor Karen Bass signs order to provide cash payments to immigrants affected by ICE raids,https://nypost.com/2025/07/11/us-news/la-mayor-karen-bass-signs-order-to-provide-cash-payments-to-immigrants-affected-by-ice-raids/
2025-07-12-02-52-54 +0000,nypost,"Ultrarunner, 60, dies after collapsing during 102-mile mountain race in Colorado",https://nypost.com/2025/07/11/us-news/ultrarunner-dies-after-collapsing-during-102-mile-hardrock-hundred-mile-endurance-run/
2025-07-12-02-41-31 +0000,nypost,Texas family mourns ‘shining light’ 8-year-old daughter confirmed dead in Camp Mystic flood disaster,https://nypost.com/2025/07/11/us-news/texas-family-mourns-shining-light-8-year-old-daughter-confirmed-dead-in-camp-mystic-flood-disaster/
2025-07-12-02-17-16 +0000,nypost,Judge bars Trump administration from making indiscriminate arrests in California immigration raids,https://nypost.com/2025/07/11/us-news/judge-bars-trump-administration-from-making-indiscriminate-arrests-in-california-immigration-raids/
2025-07-12-02-08-29 +0000,nypost,Trump grants ICE ability to arrest ‘SLIMEBALL’ protesters who attack agents after chaotic California pot farm raid,https://nypost.com/2025/07/11/us-news/trump-grants-ice-ability-to-arrest-protesters-who-attack-agents-after-california-pot-farm-raid/
2025-07-12-01-53-00 +0000,wsj,A dispute over the Federal Reserve’s renovation of its headquarters could provide the pretext to attempt the removal of Fed chief Jerome Powell over interest-rate disagreements,https://www.wsj.com/economy/central-banking/jerome-powell-fed-renovations-trump-fb9793df
2025-07-12-01-12-57 +0000,bbc,'They were just kids': Mother mourns sons killed in Israeli strike while waiting for aid,https://www.bbc.com/news/articles/cy9xgrrq54go
2025-07-12-01-07-21 +0000,bbc,A bridge too far? Prague railway project draws criticism,https://www.bbc.com/news/articles/cvg8r0v05p8o
2025-07-12-00-57-12 +0000,startribune,"New Wolves owners Marc Lore, Alex Rodriguez meet media in Las Vegas: What we learned",https://www.startribune.com/marc-lore-alex-rodriguez-new-minnesota-timberwolves-owners-news-conference-las-vegas/601390881
2025-07-12-00-40-06 +0000,bbc,Is William Ruto the most disliked president in Kenya's history?,https://www.bbc.com/news/articles/c93kv37qdeno
2025-07-12-00-39-24 +0000,bbc,North Korea's Benidorm-style resort welcomes first Russian tourists,https://www.bbc.com/news/articles/cwyrk588dlro
2025-07-12-00-33-38 +0000,bbc,Intense Med Sea heatwave raises fears for marine life,https://www.bbc.com/news/articles/c4g2v1l7j6yo
2025-07-12-00-29-57 +0000,nypost,Migrant farm worker dies after falling 30 feet from roof during chaotic California pot farm raid,https://nypost.com/2025/07/11/us-news/migrant-farm-worker-died-after-falling-30-feet-from-roof-during-chaotic-immigration-raid-at-california-pot-farm/
2025-07-12-00-19-51 +0000,bbc,Trump surveys damage in Texas as search continues for 160 missing,https://www.bbc.com/news/articles/cr5vlp0pmdzo
2025-07-12-00-14-50 +0000,nypost,Bill de Blasio and his former aides are advising Zohran Mamdani — and clamoring to get back to City Hall,https://nypost.com/2025/07/11/us-news/bill-de-blasio-and-his-former-aides-are-advising-zohran-mamdani-and-clamoring-to-get-back-to-city-hall/
2025-07-12-00-13-34 +0000,nypost,Zohran Mamdani said NYPD shouldn’t respond to domestic violence calls in resurfaced podcast interview,https://nypost.com/2025/07/11/us-news/zohran-mamdani-said-nypd-shouldnt-respond-to-domestic-violence-calls-in-resurfaced-podcast-interview/
2025-07-12-00-09-12 +0000,nypost,Mayor Adams’ lawsuit over $3.4M campaign funds withheld tossed — but here’s why it could help his re-election bid,https://nypost.com/2025/07/11/us-news/eric-adams-lawsuit-seeking-to-overrule-nyc-campaign-finance-board-thrown-out/
2025-07-12-00-07-28 +0000,bbc,The beauty and brutality of life in the shadow of Kashmir killings,https://www.bbc.com/news/articles/cjrll874eg5o
2025-07-12-00-01-53 +0000,nyt,Heat Warnings Issued for Parts of Eastern Canada,https://www.nytimes.com/2025/07/11/weather/canada-heat-warnings.html
2025-07-11-23-55-01 +0000,startribune,Prosecutors argue ex-Sen. Justin Eichorn didn’t have ‘immunity’ to sex sting charges as former lawmaker,https://www.startribune.com/prosecutors-argue-ex-sen-justin-eichorn-didnt-have-immunity-to-sex-sting-charges-as-former-lawmaker/601420513
2025-07-11-23-48-26 +0000,nypost,"Judge releases bizarre letter from would-be Trump assassin offering himself up for prisoner swap with Hamas, Iran, China or Russia",https://nypost.com/2025/07/11/us-news/judge-releases-letter-from-would-be-trump-assassin-offering-himself-up-for-prisoner-swap-with-hamas/
2025-07-11-23-32-19 +0000,nypost,"Trump concerned by Ukraine violence, as Kyiv envoy’s daughter says: ‘He wants the killing to stop’",https://nypost.com/2025/07/11/world-news/violence-in-ukraine-is-taking-a-super-personal-toll-on-trump-keith-kelloggs-daughter-says/
2025-07-11-23-30-46 +0000,startribune,Minneapolis landlord opens homeless camps on his parking lots in defiance of city,https://www.startribune.com/minneapolis-landlord-opens-homeless-camps-on-his-parking-lots-in-defiance-of-city/601419545
2025-07-11-23-20-21 +0000,nypost,"David Gergen, trusted Washington stalwart who advised 4 presidents, dead at 83",https://nypost.com/2025/07/11/us-news/david-gergen-trusted-white-house-advisor-to-4-us-presidents-across-decades-dies-at-83/
2025-07-11-23-08-37 +0000,nypost,"State Department cuts over 1,300 staffers as part of Trump administration’s sweeping overhaul",https://nypost.com/2025/07/11/us-news/state-department-cuts-over-1300-staffers-as-part-of-sweeping-overhaul/
2025-07-11-23-05-58 +0000,bbc,Canada's Carney talked tough on Trump - now some say he's backing down,https://www.bbc.com/news/articles/cvg81518yyyo
2025-07-11-23-02-11 +0000,startribune,Summit Avenue residents plan new lawsuit over bike lane,https://www.startribune.com/st-paul-summit-avenue-bike-lanes-new-lawsuit-planned/601419449
2025-07-11-22-56-32 +0000,bbc,"US has resumed military supplies to Ukraine, Zelensky says",https://www.bbc.com/news/articles/crl04200dp4o
2025-07-11-22-56-21 +0000,nyt,"Maya Ruler’s Tomb Is Unearthed in Belize, With Clues to His Ancient World",https://www.nytimes.com/2025/07/10/world/americas/maya-tomb-caracol-belize.html
2025-07-11-22-51-48 +0000,nypost,"Dow drops nearly 300 points after Trump teases 35% tariff on Canada, new threat to EU",https://nypost.com/2025/07/11/us-news/dow-drops-nearly-300-points-after-trump-teases-35-tariff-on-canada-new-threat-to-eu/
2025-07-11-22-40-54 +0000,bbc,An Indigenous Australian community is fighting to protect sacred springs from a coal mine,https://www.bbc.com/news/articles/ckglj211x9yo
2025-07-11-22-39-41 +0000,nypost,Zohran Mamdani’s campaign persona called into question by vote to give himself raise: critics,https://nypost.com/2025/07/11/us-news/zohran-mamdanis-campaign-persona-called-into-question-by-vote-to-give-himself-raise-critics/
2025-07-11-22-34-55 +0000,nyt,"Brian Clarke, Stained-Glass Innovator, Is Dead at 71",https://www.nytimes.com/2025/07/11/arts/design/brian-clarke-dead.html
2025-07-11-22-30-46 +0000,nypost,Third Biden aide Ashley Williams hauled in for questioning on ex-prez’s mental decline,https://nypost.com/2025/07/11/us-news/third-biden-aide-ashley-williams-hauled-in-for-questioning-on-ex-prezs-mental-decline/
2025-07-11-22-30-31 +0000,startribune,St. Cloud business owner accused of swindling $240K from customers,https://www.startribune.com/st-cloud-business-owner-accused-of-swindling-240k-from-customers/601420447
2025-07-11-22-28-20 +0000,bbc,Trade trumps geopolitics as Australia PM visits China,https://www.bbc.com/news/articles/c7vrjlp5zdvo
2025-07-11-22-25-34 +0000,startribune,Minneapolis City Council votes to study how to tax the rich,https://www.startribune.com/minneapolis-city-council-studies-tax-rich/601416853
2025-07-11-22-05-58 +0000,bbc,Donald Trump and the Scots: A not-so special relationship,https://www.bbc.com/news/articles/c78nv0y89p6o
2025-07-11-21-50-58 +0000,nyt,"As Trump Sows Tariff Confusion, Rules of Global Commerce Give Way to Chaos",https://www.nytimes.com/2025/07/11/world/europe/trump-tariffs-global-trade-deals.html
2025-07-11-21-44-35 +0000,nyt,How El Salvador Is Reaping Rewards From Trump’s Deportation Agenda,https://www.nytimes.com/2025/07/10/world/americas/trump-migrants-el-salvador-bukele.html
2025-07-11-21-11-54 +0000,bbc,US court rejects plea deal for '9/11 mastermind' Khalil Sheikh Mohammed,https://www.bbc.com/news/articles/c78nxqqp2leo
2025-07-11-20-40-22 +0000,nyt,Son of El Chapo Pleads Guilty to Sweeping Drug Charges,https://www.nytimes.com/2025/07/11/us/politics/el-chapo-son-pleads-guilty.html
2025-07-11-20-26-33 +0000,nyt,Want to Understand Russia? Visit Dubai.,https://www.nytimes.com/2025/07/11/world/europe/russia-dubai-iosif-prigozhin-putin.html
2025-07-11-20-16-04 +0000,startribune,"DOJ asks to look at Minnesota’s voter registration rolls, other election data",https://www.startribune.com/doj-asks-to-look-at-minnesotas-voter-registration-rolls-other-election-data/601419060
2025-07-11-19-53-20 +0000,nyt,This Year’s Aix-en-Provence Festival Is Pierre Audi’s Last Act,https://www.nytimes.com/2025/07/11/arts/music/pierre-audi-aix-festival.html
2025-07-11-19-40-14 +0000,nyt,Trump’s Latest Canada Tariff Threats Come Despite Cordial Negotiations With Carney,https://www.nytimes.com/2025/07/11/world/canada/canada-trump-tariffs-trade-talks.html
2025-07-11-19-39-41 +0000,nyt,"Evidence Supports War Crimes Allegations in Darfur, I.C.C. Prosecutor Says",https://www.nytimes.com/2025/07/11/world/africa/sudan-darfur-war-crimes.html
2025-07-11-19-22-18 +0000,bbc,Trump threatens 35% tariffs on Canadian goods,https://www.bbc.com/news/articles/cvg819n954mo
2025-07-11-19-04-37 +0000,nyt,Trump Says NATO Countries Will Buy Weapons to Give to Ukraine,https://www.nytimes.com/2025/07/11/world/europe/trump-nato-weapons-ukraine.html
2025-07-11-19-00-15 +0000,nyt,Police Investigate Burning of Migrant-Boat Effigy in Northern Ireland as a Hate Crime,https://www.nytimes.com/2025/07/11/world/europe/northern-ireland-bonfire-moygashel-migrant-boat.html
2025-07-11-18-56-19 +0000,nyt,Haiti’s Landmark Oloffson Hotel is Destroyed in an Apparent Arson Fire,https://www.nytimes.com/2025/07/07/world/americas/haiti-oloffson-hotel-fire-port-au-prince.html
2025-07-11-18-54-00 +0000,wsj,"Latest Tariff Threats Could Delay Rate Cuts, Chicago Fed’s Goolsbee Says",https://www.wsj.com/economy/central-banking/latest-tariff-threats-could-delay-rate-cuts-chicago-feds-goolsbee-says-ff7e83a8
2025-07-11-18-22-44 +0000,nyt,Republicans Blame Canada for Wildfire Smoke ‘Suffocating’ the U.S.,https://www.nytimes.com/2025/07/11/world/canada/wildfire-smoke-manitoba-us-congress.html
2025-07-11-17-45-57 +0000,nyt,Strava Fitness App Revealed Locations of Swedish Leaders,https://www.nytimes.com/2025/07/11/world/europe/strava-sweden-bodyguards-prime-minister.html
2025-07-11-17-37-00 +0000,wsj,"Nuclear power exemplifies how revamping dated and onerous rules could kick-start investment and innovation, writes the WSJ’s Greg Ip",https://www.wsj.com/economy/trumps-unsung-economic-booster-deregulation-e46bce0b
2025-07-11-17-28-33 +0000,nyt,"At Least 13 People Died by Suicide Amid U.K. Post Office Scandal, Report Says",https://www.nytimes.com/2025/07/10/world/europe/uk-post-office-scandal-report.html
2025-07-11-16-57-34 +0000,bbc,Mother mourns 'beautiful' 12-year-old shot while watching TV during Kenya protests,https://www.bbc.com/news/articles/cd6gzx85gdqo
2025-07-11-16-41-00 +0000,wsj,Canada Unemployment Rate Slips to 6.9% in June,https://www.wsj.com/economy/central-banking/canada-unemployment-rate-slips-to-6-9-in-june-ba2bbd79
2025-07-11-16-29-33 +0000,nyt,"Germany Takes an Unassuming Approach to Tax Cuts, in Contrast to Trump",https://www.nytimes.com/2025/07/11/world/europe/germany-economy-tax-cuts.html
2025-07-11-16-24-19 +0000,bbc,Russians tell the BBC how they think the Ukraine war will end,https://www.bbc.com/news/videos/c1wp55wqq0lo
2025-07-11-16-04-05 +0000,bbc,Dozens taken to hospital after suspected mass overdose in Baltimore,https://www.bbc.com/news/articles/cp8m5jggjdgo
2025-07-11-15-53-00 +0000,wsj,"Week Ahead for FX, Bonds: U.S. Inflation Data in Focus",https://www.wsj.com/economy/week-ahead-for-fx-bonds-u-s-inflation-data-in-focus-44a8d97a
2025-07-11-15-51-14 +0000,nyt,Rubio and China’s Top Envoy Vie for Influence in Asia Over Trump’s Tariffs,https://www.nytimes.com/2025/07/11/us/politics/china-us-asia-tariffs.html
2025-07-11-15-47-19 +0000,bbc,Watch: Moment child gets stuck inside a claw machine,https://www.bbc.com/news/videos/cy8kgg5l037o
2025-07-11-15-41-42 +0000,bbc,"Gaza's largest functioning hospital facing disaster, medics warn, as Israel widens offensive",https://www.bbc.com/news/articles/cdx5zeywgrgo
2025-07-11-15-20-00 +0000,latimes,"Contributor: Maybe the Epstein case isn't closed, but it's not going to be political dynamite",https://www.latimes.com/opinion/story/2025-07-11/trump-fbi-justice-department-jeffrey-epstein-client-list
2025-07-11-15-02-15 +0000,nyt,"Srebrenica, a Massacre Foretold, Still Casts Its Shadow",https://www.nytimes.com/2025/07/11/world/europe/srebrenica-massacre-bosnia.html
2025-07-11-14-53-00 +0000,wsj,"Businesses hoping for clarity on where Trump tariffs land will likely have to wait a bit longer. For now, here’s where things stand.",https://www.wsj.com/economy/trade/trump-tariffs-countries-goods-explained-b9878e1a
2025-07-11-14-44-50 +0000,nyt,"Celebrating Humanity, Stubbornly, at Europe’s Photography Mecca",https://www.nytimes.com/2025/07/11/arts/design/arles-france-rencontres-de-la-photographie.html
2025-07-11-14-39-27 +0000,nyt,20 Unforgettable Looks from Paris Couture Week,https://www.nytimes.com/2025/07/11/style/paris-couture-week-best-looks.html
2025-07-11-14-27-19 +0000,bbc,Kurdish PKK burns guns in cauldron in big step towards ending Turkey conflict,https://www.bbc.com/news/articles/cyvj5v67ly9o
2025-07-11-13-52-37 +0000,bbc,"Nigeria can't take Venezuelan deportees from US, minister says",https://www.bbc.com/news/articles/c23gz78v5jjo
2025-07-11-13-41-02 +0000,bbc,More than 150 arrests in global human trafficking crackdown,https://www.bbc.com/news/articles/c36x3z1k18no
2025-07-11-13-34-12 +0000,bbc,"Iran could recover some enriched uranium after US strikes, Israeli official says",https://www.bbc.com/news/articles/cn0qzxvydz1o
2025-07-11-13-26-30 +0000,nyt,Manitoba Declares Second Wildfire Emergency in a Near-Record Year,https://www.nytimes.com/2025/07/11/world/canada/manitoba-wildfires-2025.html
2025-07-11-13-24-30 +0000,startribune,Target calls entire commercial unit back to Minneapolis HQ three days a week,https://www.startribune.com/target-return-to-work-rick-gomez-commercial-unit-downtown-minneapolis-headquarters/601417294
2025-07-11-13-07-16 +0000,nyt,"As Climate Change Heats Up Europe’s Summers, Avignon Festival Tries to Adapt",https://www.nytimes.com/2025/07/11/theater/avignon-festival-heat-climate-change.html
2025-07-11-12-59-26 +0000,nyt,Meet the French Game Show Contestant Who Won 646 Times in a Row (and 23 Cars),https://www.nytimes.com/2025/07/11/arts/television/france-game-show.html
2025-07-11-11-55-51 +0000,bbc,Outrage builds over plan to force all Gazans to southern city,https://www.bbc.com/news/articles/c9dgv7v1d06o
2025-07-11-11-50-01 +0000,bbc,"War crimes being committed in Sudan, ICC believes",https://www.bbc.com/news/articles/cvg819yxkp5o
2025-07-11-11-35-15 +0000,startribune,The 30 restaurants most vital to the Twin Cities area right now,https://www.startribune.com/the-30-restaurants-most-vital-to-the-twin-cities-area-right-now/601328163
2025-07-11-11-21-26 +0000,nyt,Behind Trump’s Decision to Tax Brazil to Save Bolsonaro,https://www.nytimes.com/2025/07/11/world/americas/brazil-trump-tariffs.html
2025-07-11-11-17-26 +0000,bbc,Afghan cabbies' DIY solution to keep cool,https://www.bbc.com/news/videos/cgjgznve666o
2025-07-11-10-00-00 +0000,latimes,How a Supreme Court win for public health bolstered RFK Jr. and threatens no-cost vaccines,https://www.latimes.com/politics/story/2025-07-11/supreme-court-ruling-bolsters-rfk-jr-threatens-no-cost-vaccines-and-other-health-screenings
2025-07-11-10-00-00 +0000,latimes,Contributor: Will Democrats find an anti-Trump to galvanize the left?,https://www.latimes.com/opinion/story/2025-07-11/zohran-mamdani-democratic-presidential-candidate-2028
2025-07-11-10-00-00 +0000,latimes,"Barabak: He tried to keep Trump from a second term. But six months in, 'I'm very impressed.'",https://www.latimes.com/politics/story/2025-07-11/trumps-america-oil-and-gas-executive-denver-colorado
2025-07-11-09-25-00 +0000,wsj,"ECB’s Bar for Another Rate Cut Is High, Schnabel Says",https://www.wsj.com/articles/ecbs-bar-for-another-rate-cut-is-high-schnabel-says-fe302495
2025-07-11-09-01-21 +0000,nyt,How This River in Thailand Was Poisoned,https://www.nytimes.com/video/world/asia/100000010272461/thailand-kok-river-myanmar-rare-earths-explained.html
2025-07-11-09-00-37 +0000,nyt,"In ‘Apocalypse in the Tropics,’ Director Petra Costa Examines Brazil’s Rightward Shift",https://www.nytimes.com/2025/07/11/movies/petra-costa-brazil-politics-documentary.html
2025-07-11-08-57-33 +0000,bbc,Watch: Child migrants' fears trying to cross the Channel,https://www.bbc.com/news/videos/c36x3k6y4zzo
2025-07-11-08-14-13 +0000,bbc,'I created it myself': The boy behind the viral 'aura farming' boat racing dance,https://www.bbc.com/news/articles/czxe7ey59r0o
2025-07-11-06-59-00 +0000,wsj,U.K. Economy Unexpectedly Slumps to Second Straight Month of Contraction,https://www.wsj.com/economy/global/u-k-economy-slumps-to-second-straight-month-of-contraction-40cb4c11
