pubdate,source,title,link
2025-07-13-04-42-56 +0000,nypost,DOJ drops charges against Utah surgeon accused of injecting fake COVID-19 shots and destroying $28K of real vaccines,https://nypost.com/2025/07/13/us-news/doj-drops-charges-against-utah-surgeon-accused-of-injecting-fake-covid-19-shots-and-destroying-28k-of-real-vaccines/
2025-07-13-04-28-08 +0000,nyt,Modi Wants More Indians to Speak Hindi. Some States Are Shouting ‘No.’,https://www.nytimes.com/2025/07/13/world/asia/india-modi-hindi.html
2025-07-13-03-34-49 +0000,bbc,EU and Mexico criticise Trump's proposed 30% tariff,https://www.bbc.com/news/articles/cyvj13d9ylpo
2025-07-13-03-06-33 +0000,nypost,Knife-wielding robbery suspect on e-bike hit and killed by car during NYC police chase,https://nypost.com/2025/07/12/us-news/knife-wielding-robbery-suspect-on-e-bike-hit-and-killed-by-car-during-nyc-police-chase/
2025-07-13-02-44-25 +0000,nypost,Border czar Tom Homan delivers fiery response to anti-ICE activist interrupting him: ‘You want some? Come get some’,https://nypost.com/2025/07/12/us-news/border-czar-tom-homan-delivers-stern-warning-to-anti-ice-protesters-you-want-some-come-get-some/
2025-07-13-02-24-58 +0000,nypost,"Twisted Nevada mom, 28, accused of tossing newborn in dumpster –said abandoning child in trash ‘was her best option’",https://nypost.com/2025/07/12/us-news/twisted-nevada-mom-28-accused-of-tossing-newborn-in-dumpster-said-abandoning-child-in-trash-was-her-best-option/
2025-07-13-01-04-00 +0000,wsj,Answers to frequently asked questions about The Wall Street Journal's Economic Forecasting survey plus links to stories and archival data.,https://www.wsj.com/economy/economic-forecasting-survey-archive-11617814998
2025-07-13-01-00-00 +0000,wsj,"Economists expect stronger growth and job creation, lower risk of recession and cooler inflation than they did three months ago, according to a Wall Street Journal survey",https://www.wsj.com/economy/economists-see-lower-recession-risk-and-stronger-job-growth-wsj-survey-10d6e476
2025-07-13-00-16-32 +0000,nypost,"Mass shooting erupts at Tennessee class reunion, sending four to the hospital — shooter on the loose",https://nypost.com/2025/07/12/us-news/reunion-in-tennesee-cut-short-by-shooting-that-wounds-four/
2025-07-13-00-00-42 +0000,bbc,Putin's friend Gergiev set to perform as Italy breaks ban on pro-Kremlin artists,https://www.bbc.com/news/articles/czxw4n7vy70o
2025-07-12-23-56-51 +0000,nypost,Trump defends Pam Bondi hours after FBI boss Kash Patel squashed ‘conspiracy’ resignation rumors over Epstein files uproar,https://nypost.com/2025/07/12/us-news/trump-defends-pam-bondi-hours-after-fbi-boss-kash-patel-squashed-conspiracy-resignation-rumors-over-epstein-files-uproar/
2025-07-12-23-56-15 +0000,bbc,When an unsung Indian helped Austrian Jews escape the Nazis,https://www.bbc.com/news/articles/crl0r5wrkexo
2025-07-12-23-45-33 +0000,nyt,Air India Plane Crash Report Says Fuel to Engines Was Cut Off,https://www.nytimes.com/2025/07/11/world/asia/air-india-crash-report.html
2025-07-12-23-40-23 +0000,bbc,BBC gains rare access to the Congolese mine powering mobile phones,https://www.bbc.com/news/articles/cyvj986l615o
2025-07-12-23-38-06 +0000,nypost,Sonic scientists create fiery show in Brooklyn  with experimental instruments that spew flames,https://nypost.com/2025/07/12/us-news/fire-spewing-instruments-on-display-in-brooklyn/
2025-07-12-23-22-07 +0000,nypost,Bringing down the dog house: cute pets gather with stars at Shubert Alley for Broadway Barks adoption event,https://nypost.com/2025/07/12/us-news/stars-turn-out-for-27th-broadway-barks-event/
2025-07-12-23-13-58 +0000,bbc,North Korea reaffirms support for Russia's war in Ukraine,https://www.bbc.com/news/articles/czeyxrng6gro
2025-07-12-23-05-15 +0000,bbc,Judge bars Trump administration from 'indiscriminately' detaining immigrants,https://www.bbc.com/news/articles/c4ge469g7p5o
2025-07-12-22-31-52 +0000,nypost,"Socialist NYC mayoral candidate Zohran Mamdani’s dad sits on council of anti-Israel group, sympathetic of suicide bombers",https://nypost.com/2025/07/12/us-news/mamdanis-dad-part-of-anti-israel-group-sympathetic-to-suicide-bombers/
2025-07-12-22-29-02 +0000,nypost,Trump set to join prestigious presidential roadway honor roll near his beloved Florida estate,https://nypost.com/2025/07/12/us-news/trump-set-to-join-prestigious-presidential-roadway-honor-roll-near-his-beloved-florida-estate/
2025-07-12-22-10-44 +0000,nypost,"Blazing inferno tears through Bay Ridge building in Brooklyn, injuring 4 including firefighter",https://nypost.com/2025/07/12/us-news/marshals-probing-cause-of-blaze/
2025-07-12-22-00-31 +0000,nypost,At least one killed after two men jump into NYC waters in separate incidents,https://nypost.com/2025/07/12/us-news/one-man-jumped-off-bridge-another-entered-water-from-pier/
2025-07-12-21-56-09 +0000,nypost,"Video appears to show woman plowing through ICE protestors in New Jersey, injuring 3",https://nypost.com/2025/07/12/us-news/woman-drives-through-ice-protest-in-north-new-jersey/
2025-07-12-21-49-47 +0000,bbc,Gaza hospital says 24 people killed near aid site as witnesses blame IDF,https://www.bbc.com/news/articles/cp90v2ng70yo
2025-07-12-21-40-49 +0000,nypost,These are the forgotten NYC nabes that became real estate hot spots in the last decade: report,https://nypost.com/2025/07/12/real-estate/median-sale-prices-doubled-or-more-in-these-24-nyc-neighborhoods-report/
2025-07-12-21-34-16 +0000,nypost,Swarthy 21-year-old wins ‘complete joke’ Leonardo DiCaprio lookalike contest,https://nypost.com/2025/07/12/lifestyle/this-21-year-old-nj-resident-was-crowned-leonardo-dicaprio-doppelganger/
2025-07-12-21-17-00 +0000,wsj,"President Trump traveled to the site of the Texas floods with two missions—to console, and to tout a new response to disasters where Washington takes a back seat to state and local responders",https://www.wsj.com/politics/policy/trump-texas-flood-visit-a7531953
2025-07-12-21-11-05 +0000,bbc,The mushroom killer was obsessed with true crime. Now true crime fans are obsessed with her,https://www.bbc.com/news/articles/c0m8glx2zleo
2025-07-12-20-56-38 +0000,nypost,"Secret Service officials were aware of ‘classified threat’ 10 days before Butler assassination attempt, failed to tell agents guarding Trump",https://nypost.com/2025/07/12/us-news/top-secret-service-officials-were-aware-of-classified-threat-10-days-before-butler-assassination-attempt-and-failed-to-tell-agents-law-enforcement-guarding-trump/
2025-07-12-20-45-52 +0000,nypost,"Ocasio-Cortez slammed over ‘defamatory’ Trump, Jeffrey Epstein post: ‘Sue AOC into bankruptcy’",https://nypost.com/2025/07/12/us-news/ocasio-cortez-slammed-over-defamatory-trump-jeffrey-epstein-post-sue-aoc-into-bankruptcy/
2025-07-12-20-22-44 +0000,nypost,"Gun-toting duo pistol-whip, rip $75K in jewelry off victim at his luxury NY pad: cops",https://nypost.com/2025/07/12/us-news/masked-gun-toting-duo-rip-75k-in-jewelry-from-westchester-homeowner/
2025-07-12-20-12-43 +0000,nypost,"Notorious member of ‘Hillside Stranglers’ serial killing duo, Kenneth Bianchi, denied parole",https://nypost.com/2025/07/12/us-news/hillside-stranglers-parole-denied-for-the-8th-time-by-california-board/
2025-07-12-20-04-51 +0000,nypost,Iranian fatwa crowdfunding effort claims to have raised $40M for bounty on President Trump’s head,https://nypost.com/2025/07/12/us-news/iranian-fatwa-crowdfunding-effort-raises-40m-to-kill-president-trump/
2025-07-12-19-40-22 +0000,nyt,Rubio Visits Asia in Shadow of Trump’s Tariffs,https://www.nytimes.com/video/world/asia/100000010277461/rubio-visits-asia-in-shadow-of-trumps-tariffs.html
2025-07-12-19-38-25 +0000,bbc,"Arizona resident dies from plague, health officials say",https://www.bbc.com/news/articles/cz7l8w8881qo
2025-07-12-17-01-00 +0000,wsj,"The U.S. will charge a 30% tariff on the European Union and Mexico effective Aug. 1, President Trump said in letters to the leaders of each trading partner, posted on Truth Social",https://www.wsj.com/economy/trade/trump-threatens-30-tariffs-on-eu-mexico-c48ce36f
2025-07-12-16-50-32 +0000,bbc,Mystery of Air India crash deepens as report reveals cockpit audio,https://www.bbc.com/news/articles/cx2gy78gpnqo
2025-07-12-15-19-11 +0000,nyt,Timeline Details Final Seconds of Crashed Air India Flight,https://www.nytimes.com/2025/07/12/world/asia/air-india-crash-report-timeline.html
2025-07-12-15-00-00 +0000,wsj,"Pardoned Jan. 6 defendants are the new draw at local GOP fundraisers, helping fill seats while getting a platform to recast the narrative of the riot at the U.S. Capitol",https://www.wsj.com/politics/jan-6-rioters-are-the-new-hot-event-in-town-for-republicans-e3a02170
2025-07-12-14-34-23 +0000,bbc,"Israeli settlers kill Palestinians in West Bank attack, health ministry says",https://www.bbc.com/news/articles/cm2mknzn99eo
2025-07-12-14-00-00 +0000,wsj,The White House has an explanation for the nearly $2 trillion of manufacturing-related projects announced since the start of the year. It’s the Trump Effect.,https://www.wsj.com/politics/policy/trump-new-us-factories-d2981280
2025-07-12-12-00-00 +0000,wsj,"Nearly six months into President Trump’s second term, voluntary departures from the government have thinned the ranks so much that some agencies are saying more cuts aren’t necessary after all",https://www.wsj.com/politics/policy/federal-layoff-plans-buyout-offers-9d115dcd
2025-07-12-11-44-37 +0000,nyt,"As Trump Sows Tariff Confusion, Rules of Global Commerce Give Way to Chaos",https://www.nytimes.com/2025/07/11/world/europe/trump-tariffs-global-trade-deals.html
2025-07-12-11-20-48 +0000,bbc,German backpacker found after 11 nights in Australia's outback,https://www.bbc.com/news/articles/c17w87pv5ljo
2025-07-12-10-47-08 +0000,bbc,'Was this avoidable?': Families of Air India crash victims seek answers,https://www.bbc.com/news/articles/c5ylv04r1eyo
2025-07-12-10-00-09 +0000,nyt,A Beloved Canadian Chocolate Bar Disappears From the Market,https://www.nytimes.com/2025/07/12/world/canada/neilson-jersey-milk-discontinued.html
2025-07-12-09-30-00 +0000,wsj,Pittsburgh is striving to turn its old steel mills into a high-tech center to help reverse economic decline,https://www.wsj.com/tech/ai/can-pittsburghs-old-steel-mills-be-turned-into-an-ai-hub-bb2dd8ff
2025-07-12-09-00-22 +0000,nyt,A Landscape of Death: What’s Left Where Ukraine Invaded Russia,https://www.nytimes.com/2025/07/12/world/europe/ukraine-russia-kursk.html
2025-07-12-06-04-07 +0000,bbc,"Air India report may lead to answers, but not closure for families",https://www.bbc.com/news/videos/c80pj0pv974o
