pubdate,source,title,link
2025-07-12-23-45-33 +0000,nyt,Air India Plane Crash Report Says Fuel to Engines Was Cut Off,https://www.nytimes.com/2025/07/11/world/asia/air-india-crash-report.html
2025-07-12-23-40-23 +0000,bbc,BBC gains rare access to the Congolese mine powering mobile phones,https://www.bbc.com/news/articles/cyvj986l615o
2025-07-12-23-38-06 +0000,nypost,Sonic scientists create fiery show in Brooklyn  with experimental instruments that shoot flames,https://nypost.com/2025/07/12/us-news/fire-spewing-instruments-on-display-in-brooklyn/
2025-07-12-23-22-07 +0000,nypost,Bringing down the dog house: cute pets gather with stars at Shubert Alley for Broadway Barks adoption event,https://nypost.com/2025/07/12/us-news/stars-turn-out-for-27th-broadway-barks-event/
2025-07-12-23-13-58 +0000,bbc,North Korea reaffirms support for Russia's war in Ukraine,https://www.bbc.com/news/articles/czeyxrng6gro
2025-07-12-22-31-52 +0000,nypost,"Socialist NYC mayoral candidate Zohran Mamdani’s dad sits on council of anti-Israel group, sympathetic of suicide bombers",https://nypost.com/2025/07/12/us-news/mamdanis-dad-part-of-anti-israel-group-sympathetic-to-suicide-bombers/
2025-07-12-22-29-02 +0000,nypost,Trump set to join prestigious presidential roadway honor roll near his beloved Florida estate,https://nypost.com/2025/07/12/us-news/trump-set-to-join-prestigious-presidential-roadway-honor-roll-near-his-beloved-florida-estate/
2025-07-12-22-10-44 +0000,nypost,"Blazing inferno tears through Bay Ridge building in Brooklyn, injuring 4 including firefighter",https://nypost.com/2025/07/12/us-news/marshals-probing-cause-of-blaze/
2025-07-12-22-00-31 +0000,nypost,At least one killed after two men jump into NYC waters in separate incidents,https://nypost.com/2025/07/12/us-news/one-man-jumped-off-bridge-another-entered-water-from-pier/
2025-07-12-21-56-09 +0000,nypost,"Video appears to show woman plowing through ICE protestors in New Jersey, injuring 3",https://nypost.com/2025/07/12/us-news/woman-drives-through-ice-protest-in-north-new-jersey/
2025-07-12-21-52-59 +0000,bbc,Morocco and Zambia win to reach Wafcon quarter-finals,https://www.bbc.com/sport/football/articles/cly1914y133o
2025-07-12-21-40-49 +0000,nypost,These are the forgotten NYC nabes that became real estate hot spots in the last decade: report,https://nypost.com/2025/07/12/real-estate/median-sale-prices-doubled-or-more-in-these-24-nyc-neighborhoods-report/
2025-07-12-21-34-16 +0000,nypost,Swarthy 21-year-old wins ‘complete joke’ Leonardo DiCaprio lookalike contest,https://nypost.com/2025/07/12/lifestyle/this-21-year-old-nj-resident-was-crowned-leonardo-dicaprio-doppelganger/
2025-07-12-21-18-42 +0000,bbc,Everything you need to know about Wafcon 2024 finals,https://www.bbc.com/sport/football/articles/cqj7k2pwx4no
2025-07-12-21-17-00 +0000,wsj,"President Trump traveled to the site of the Texas floods with two missions—to console, and to tout a new response to disasters where Washington takes a back seat to state and local responders",https://www.wsj.com/politics/policy/trump-texas-flood-visit-a7531953
2025-07-12-21-11-05 +0000,bbc,The mushroom killer was obsessed with true crime. Now true crime fans are obsessed with her,https://www.bbc.com/news/articles/c0m8glx2zleo
2025-07-12-20-56-38 +0000,nypost,"Secret Service officials were aware of ‘classified threat’ 10 days before Butler assassination attempt, failed to tell agents guarding Trump",https://nypost.com/2025/07/12/us-news/top-secret-service-officials-were-aware-of-classified-threat-10-days-before-butler-assassination-attempt-and-failed-to-tell-agents-law-enforcement-guarding-trump/
2025-07-12-20-45-52 +0000,nypost,"Ocasio-Cortez slammed over ‘defamatory’ Trump, Jeffrey Epstein post: ‘Sue AOC into bankruptcy’",https://nypost.com/2025/07/12/us-news/ocasio-cortez-slammed-over-defamatory-trump-jeffrey-epstein-post-sue-aoc-into-bankruptcy/
2025-07-12-20-22-44 +0000,nypost,"Gun-toting duo pistol-whip, rip $75K in jewelry off victim at his luxury NY pad: cops",https://nypost.com/2025/07/12/us-news/masked-gun-toting-duo-rip-75k-in-jewelry-from-westchester-homeowner/
2025-07-12-20-12-43 +0000,nypost,"Notorious member of ‘Hillside Stranglers’ serial killing duo, Kenneth Bianchi, denied parole",https://nypost.com/2025/07/12/us-news/hillside-stranglers-parole-denied-for-the-8th-time-by-california-board/
2025-07-12-20-04-51 +0000,nypost,Iranian fatwa crowdfunding effort claims to have raised $40M for bounty on President Trump’s head,https://nypost.com/2025/07/12/us-news/iranian-fatwa-crowdfunding-effort-raises-40m-to-kill-president-trump/
2025-07-12-19-51-56 +0000,nypost,Billionaire’s son ignored $15M promise to buy Jackson Pollock painting: lawsuit,https://nypost.com/2025/07/12/us-news/david-mimran-sued-for-failing-to-pay-for-15m-jackson-pollock/
2025-07-12-19-49-53 +0000,nypost,Bill Gates’ net worth plummets $51B within days as Microsoft mogul amps up philanthropy,https://nypost.com/2025/07/12/us-news/bill-gates-net-worth-plummets-51-billion-within-days/
2025-07-12-19-40-22 +0000,nyt,Rubio Visits Asia in Shadow of Trump’s Tariffs,https://www.nytimes.com/video/world/asia/100000010277461/rubio-visits-asia-in-shadow-of-trumps-tariffs.html
2025-07-12-19-11-22 +0000,nypost,Wild video shows NYPD cop duke it out with brute during intense Starbucks brawl,https://nypost.com/2025/07/12/us-news/video-nypd-officer-dukes-it-out-with-wild-brute-throwing-food-during-starbucks-morning-smackdown/
2025-07-12-18-28-05 +0000,nypost,"Possible rare mountain lion sighting in Rochester has residents panicking, as the city issues shelter-in-place order",https://nypost.com/2025/07/12/lifestyle/mountain-lion-possibly-sighted-in-this-new-york-city/
2025-07-12-17-32-37 +0000,nyt,Who Is the ‘Aura Farming’ Boat Race Kid on TikTok?,https://www.nytimes.com/2025/07/10/style/aura-farming-indonesia-boat-kid.html
2025-07-12-17-13-04 +0000,nyt,Two Palestinians Are Killed in a West Bank Clash With Israeli Settlers,https://www.nytimes.com/2025/07/12/world/middleeast/palestinians-killed-by-israelis-in-west-bank.html
2025-07-12-17-11-45 +0000,nypost,15-year-old illegal migrant arrested for Long Island murder: cops,https://nypost.com/2025/07/12/us-news/15-year-old-illegal-migrant-arrested-for-long-island-murder-cops/
2025-07-12-17-07-03 +0000,nyt,"Russia Sees France as Its Main Enemy in Europe, French General Says",https://www.nytimes.com/2025/07/11/europe-france-general-russia-enemy.html
2025-07-12-17-01-00 +0000,wsj,"The U.S. will charge a 30% tariff on the European Union and Mexico effective Aug. 1, President Trump said in letters to the leaders of each trading partner, posted on Truth Social",https://www.wsj.com/economy/trade/trump-threatens-30-tariffs-on-eu-mexico-c48ce36f
2025-07-12-16-58-40 +0000,nypost,College student attacked over NYC parking spot leaves Queens neighborhood — despite large show of community support,https://nypost.com/2025/07/12/us-news/college-student-in-parking-spot-brawl-reunites-lone-rescuer/
2025-07-12-16-50-32 +0000,bbc,Why cockpit audio deepens the mystery of Air India crash,https://www.bbc.com/news/articles/cx2gy78gpnqo
2025-07-12-15-19-10 +0000,nyt,Timeline Details Final Seconds of Crashed Air India Flight,https://www.nytimes.com/2025/07/12/world/asia/air-india-crash-report-timeline.html
2025-07-12-15-00-00 +0000,wsj,"Pardoned Jan. 6 defendants are the new draw at local GOP fundraisers, helping fill seats while getting a platform to recast the narrative of the riot at the U.S. Capitol",https://www.wsj.com/politics/jan-6-rioters-are-the-new-hot-event-in-town-for-republicans-e3a02170
2025-07-12-14-00-00 +0000,wsj,The White House has an explanation for the nearly $2 trillion of manufacturing-related projects announced since the start of the year. It’s the Trump Effect.,https://www.wsj.com/politics/policy/trump-new-us-factories-d2981280
2025-07-12-12-00-00 +0000,wsj,"Nearly six months into President Trump’s second term, voluntary departures from the government have thinned the ranks so much that some agencies are saying more cuts aren’t necessary after all",https://www.wsj.com/politics/policy/federal-layoff-plans-buyout-offers-9d115dcd
2025-07-12-11-44-37 +0000,nyt,"As Trump Sows Tariff Confusion, Rules of Global Commerce Give Way to Chaos",https://www.nytimes.com/2025/07/11/world/europe/trump-tariffs-global-trade-deals.html
2025-07-12-11-13-43 +0000,nyt,They Fled War in Ethiopia. Then American Bombs Found Them.,https://www.nytimes.com/2025/07/12/world/middleeast/ethiopia-yemen-american-bombs.html
2025-07-12-10-47-08 +0000,bbc,'Was this avoidable?': Families of Air India crash victims seek answers,https://www.bbc.com/news/articles/c5ylv04r1eyo
2025-07-12-10-00-09 +0000,nyt,A Beloved Canadian Chocolate Bar Disappears From the Market,https://www.nytimes.com/2025/07/12/world/canada/neilson-jersey-milk-discontinued.html
2025-07-12-09-30-00 +0000,wsj,Pittsburgh is striving to turn its old steel mills into a high-tech center to help reverse economic decline,https://www.wsj.com/tech/ai/can-pittsburghs-old-steel-mills-be-turned-into-an-ai-hub-bb2dd8ff
2025-07-12-09-01-25 +0000,nyt,"Flash Floods Are the ‘Hardest Kind’ of Disaster to Prevent, Experts Say",https://www.nytimes.com/2025/07/12/climate/flash-floods-disaster-prevention.html
2025-07-12-09-00-22 +0000,nyt,A Landscape of Death: What’s Left Where Ukraine Invaded Russia,https://www.nytimes.com/2025/07/12/world/europe/ukraine-russia-kursk.html
2025-07-12-08-35-29 +0000,bbc,What we know so far about Air India crash investigation,https://www.bbc.com/news/articles/c5y5nq170z4o
2025-07-12-05-46-13 +0000,nyt,Appeals Court Overturns Plea Deal in 9/11 Case,https://www.nytimes.com/2025/07/11/us/politics/appeals-court-overturns-9-11-plea-deal.html
2025-07-12-04-01-13 +0000,nyt,"When It’s This Hot, ‘We Are Enduring, Not Living’",https://www.nytimes.com/2025/07/12/world/asia/pakistan-heat.html
2025-07-12-04-01-07 +0000,nyt,How to Panic Italians? Jack Up the Price of Espresso.,https://www.nytimes.com/2025/07/12/world/europe/espresso-italy-coffee-prices.html
2025-07-12-03-31-56 +0000,nyt,How Netanyahu Prolonged the War in Gaza to Stay in Power,https://www.nytimes.com/2025/07/11/magazine/benjamin-netanyahu-gaza-war.html
2025-07-12-01-53-00 +0000,wsj,A dispute over the Federal Reserve’s renovation of its headquarters could provide the pretext to attempt the removal of Fed chief Jerome Powell over interest-rate disagreements,https://www.wsj.com/economy/central-banking/jerome-powell-fed-renovations-trump-fb9793df
2025-07-12-00-40-06 +0000,bbc,Is William Ruto the most disliked president in Kenya's history?,https://www.bbc.com/news/articles/c93kv37qdeno
2025-07-12-00-39-24 +0000,bbc,North Korea's Benidorm-style resort welcomes first Russian tourists,https://www.bbc.com/news/articles/cwyrk588dlro
2025-07-12-00-07-28 +0000,bbc,The beauty and brutality of life in the shadow of Kashmir killings,https://www.bbc.com/news/articles/cjrll874eg5o
2025-07-12-00-01-53 +0000,nyt,Heat Warnings Issued for Parts of Eastern Canada,https://www.nytimes.com/2025/07/11/weather/canada-heat-warnings.html
2025-07-12-00-00-00 +0000,wsj,The U.S.’s dramatic research and funding cuts as well as changes to skilled-worker immigration policies threaten one of its greatest economic advantages: people-powered innovation,https://www.wsj.com/politics/policy/us-brain-drain-recruitment-02df18a7
