pubdate,source,title,link
2025-07-12-11-49-20 +0000,nyt,Air India Plane Crash Report Says Fuel to Engines Was Cut Off,https://www.nytimes.com/2025/07/11/world/asia/air-india-crash-report.html
2025-07-12-11-44-37 +0000,nyt,"As Trump Sows Tariff Confusion, Rules of Global Commerce Give Way to Chaos",https://www.nytimes.com/2025/07/11/world/europe/trump-tariffs-global-trade-deals.html
2025-07-12-11-23-19 +0000,bbc,"Labour not defending workers, says Unite after Rayner row",https://www.bbc.com/news/articles/cn819l4229mo
2025-07-12-10-47-08 +0000,bbc,'Was this avoidable?': Families of Air India crash victims seek answers,https://www.bbc.com/news/articles/c5ylv04r1eyo
2025-07-12-10-00-09 +0000,nyt,A Beloved Canadian Chocolate Bar Disappears From the Market,https://www.nytimes.com/2025/07/12/world/canada/neilson-jersey-milk-discontinued.html
2025-07-12-09-30-00 +0000,wsj,"How the Tragedy at Camp Mystic Unfolded, Cabin by Cabin",https://www.wsj.com/articles/camp-mystic-texas-flood-what-happened-9dbde882
2025-07-12-09-25-13 +0000,bbc,"Two Palestinians killed in West Bank settler attack, health ministry says",https://www.bbc.com/news/articles/cm2mknzn99eo
2025-07-12-09-01-16 +0000,nyt,Tariffs or Deals? Trump Seems Content With Punishing Levies.,https://www.nytimes.com/2025/07/12/business/economy/trump-tariffs-deals.html
2025-07-12-09-00-22 +0000,nyt,A Landscape of Death: What’s Left Where Ukraine Invaded Russia,https://www.nytimes.com/2025/07/12/world/europe/ukraine-russia-kursk.html
2025-07-12-06-04-07 +0000,bbc,"Air India report may lead to answers, but not closure for families",https://www.bbc.com/news/videos/c80pj0pv974o
2025-07-12-04-20-41 +0000,bbc,"Gaza ceasefire talks on verge of collapse, Palestinian officials say",https://www.bbc.com/news/articles/cqjq9p87vdvo
2025-07-12-04-01-13 +0000,nyt,"When It’s This Hot, ‘We Are Enduring, Not Living’",https://www.nytimes.com/2025/07/12/world/asia/pakistan-heat.html
2025-07-12-04-01-07 +0000,nyt,How to Panic Italians? Jack Up the Price of Espresso.,https://www.nytimes.com/2025/07/12/world/europe/espresso-italy-coffee-prices.html
2025-07-12-03-27-00 +0000,wsj,Federal Judge Halts Immigration Raid Tactics in Los Angeles,https://www.wsj.com/us-news/law/federal-judge-halts-immigration-raid-tactics-in-los-angeles-fc8819a8
2025-07-12-03-00-16 +0000,bbc,Federal judge says voice-over artists' AI lawsuit can move forward,https://www.bbc.com/news/articles/cedgzj8z1wjo
2025-07-12-02-59-22 +0000,bbc,Why cockpit audio deepens the mystery of Air India crash,https://www.bbc.com/news/articles/cx2gy78gpnqo
2025-07-12-01-12-57 +0000,bbc,'They were just kids': Mother mourns sons killed in Israeli strike while waiting for aid,https://www.bbc.com/news/articles/cy9xgrrq54go
2025-07-12-01-07-21 +0000,bbc,A bridge too far? Prague railway project draws criticism,https://www.bbc.com/news/articles/cvg8r0v05p8o
2025-07-12-00-40-06 +0000,bbc,Is William Ruto the most disliked president in Kenya's history?,https://www.bbc.com/news/articles/c93kv37qdeno
2025-07-12-00-39-24 +0000,bbc,North Korea's Benidorm-style resort welcomes first Russian tourists,https://www.bbc.com/news/articles/cwyrk588dlro
2025-07-12-00-33-38 +0000,bbc,Intense Med Sea heatwave raises fears for marine life,https://www.bbc.com/news/articles/c4g2v1l7j6yo
2025-07-12-00-19-51 +0000,bbc,Trump surveys damage in Texas as search continues for 160 missing,https://www.bbc.com/news/articles/cr5vlp0pmdzo
2025-07-12-00-07-28 +0000,bbc,The beauty and brutality of life in the shadow of Kashmir killings,https://www.bbc.com/news/articles/cjrll874eg5o
2025-07-12-00-01-53 +0000,nyt,Heat Warnings Issued for Parts of Eastern Canada,https://www.nytimes.com/2025/07/11/weather/canada-heat-warnings.html
2025-07-11-23-05-58 +0000,bbc,Canada's Carney talked tough on Trump - now some say he's backing down,https://www.bbc.com/news/articles/cvg81518yyyo
2025-07-11-22-56-32 +0000,bbc,"US has resumed military supplies to Ukraine, Zelensky says",https://www.bbc.com/news/articles/crl04200dp4o
2025-07-11-22-56-21 +0000,nyt,"Maya Ruler’s Tomb Is Unearthed in Belize, With Clues to His Ancient World",https://www.nytimes.com/2025/07/10/world/americas/maya-tomb-caracol-belize.html
2025-07-11-22-53-15 +0000,bbc,Watch: What we know about the fuel switches on Air India flight 171,https://www.bbc.com/news/videos/cx2vrdd5xkeo
2025-07-11-22-42-00 +0000,wsj,Columbia Has Discussed $200 Million Payment in Civil-Rights Settlement With Trump Administration,https://www.wsj.com/us-news/education/trump-columbia-civil-rights-settlement-86f64531
2025-07-11-22-40-54 +0000,bbc,An Indigenous Australian community is fighting to protect sacred springs from a coal mine,https://www.bbc.com/news/articles/ckglj211x9yo
2025-07-11-22-34-55 +0000,nyt,"Brian Clarke, Stained-Glass Innovator, Is Dead at 71",https://www.nytimes.com/2025/07/11/arts/design/brian-clarke-dead.html
2025-07-11-22-28-20 +0000,bbc,Trade trumps geopolitics as Australia PM visits China,https://www.bbc.com/news/articles/c7vrjlp5zdvo
2025-07-11-22-05-58 +0000,bbc,Donald Trump and the Scots: A not-so special relationship,https://www.bbc.com/news/articles/c78nv0y89p6o
2025-07-11-21-44-35 +0000,nyt,How El Salvador Is Reaping Rewards From Trump’s Deportation Agenda,https://www.nytimes.com/2025/07/10/world/americas/trump-migrants-el-salvador-bukele.html
2025-07-11-21-34-00 +0000,wsj,Opinion | A Second Push for Mike Lee’s Federal Land Sales,https://www.wsj.com/opinion/federal-land-sales-congress-gop-mike-lee-doug-burgum-80c664a7
2025-07-11-21-11-54 +0000,bbc,US court rejects plea deal for '9/11 mastermind' Khalil Sheikh Mohammed,https://www.bbc.com/news/articles/c78nxqqp2leo
2025-07-11-21-06-00 +0000,wsj,Court Quashes Sept. 11 Plea Bargains That Military Judge Had Approved,https://www.wsj.com/us-news/law/september-11-plot-plea-deals-e781e88d
2025-07-11-20-49-00 +0000,wsj,Opinion | The Worst Way to Tax Sports Betting,https://www.wsj.com/opinion/the-worst-way-to-tax-sports-betting-72278489
2025-07-11-20-47-00 +0000,wsj,Opinion | Russia Intensifies Its Drone War,https://www.wsj.com/opinion/russia-intensifies-its-drone-war-on-civilian-areas-reporting-from-kyiv-adaffb2d
2025-07-11-20-45-00 +0000,wsj,Opinion | Bloomberg’s Antigun Nonprofit Targets a Mom-and-Pop Store,https://www.wsj.com/opinion/bloombergs-antigun-nonprofit-targets-a-mom-and-pop-store-1af1359f
2025-07-11-20-44-00 +0000,wsj,Opinion | Notable & Quotable: ‘We Are a Big-Tent Party’,https://www.wsj.com/opinion/notable-quotable-we-are-a-big-tent-party-dnc-chairman-mamdani-c81f0f04
2025-07-11-20-42-00 +0000,wsj,"Opinion | Trump vs. U.S. Intelligence Agencies, Round 7",https://www.wsj.com/opinion/trump-vs-u-s-intelligence-agencies-round-7-81689d06
2025-07-11-20-40-22 +0000,nyt,Son of El Chapo Pleads Guilty to Sweeping Drug Charges,https://www.nytimes.com/2025/07/11/us/politics/el-chapo-son-pleads-guilty.html
2025-07-11-20-26-33 +0000,nyt,Want to Understand Russia? Visit Dubai.,https://www.nytimes.com/2025/07/11/world/europe/russia-dubai-iosif-prigozhin-putin.html
2025-07-11-19-53-20 +0000,nyt,This Year’s Aix-en-Provence Festival Is Pierre Audi’s Last Act,https://www.nytimes.com/2025/07/11/arts/music/pierre-audi-aix-festival.html
2025-07-11-19-40-14 +0000,nyt,Trump’s Latest Canada Tariff Threats Come Despite Cordial Negotiations With Carney,https://www.nytimes.com/2025/07/11/world/canada/canada-trump-tariffs-trade-talks.html
2025-07-11-19-39-41 +0000,nyt,"Evidence Supports War Crimes Allegations in Darfur, I.C.C. Prosecutor Says",https://www.nytimes.com/2025/07/11/world/africa/sudan-darfur-war-crimes.html
2025-07-11-19-22-18 +0000,bbc,Trump threatens 35% tariffs on Canadian goods,https://www.bbc.com/news/articles/cvg819n954mo
2025-07-11-19-04-37 +0000,nyt,Trump Says NATO Countries Will Buy Weapons to Give to Ukraine,https://www.nytimes.com/2025/07/11/world/europe/trump-nato-weapons-ukraine.html
2025-07-11-19-00-15 +0000,nyt,Police Investigate Burning of Migrant-Boat Effigy in Northern Ireland as a Hate Crime,https://www.nytimes.com/2025/07/11/world/europe/northern-ireland-bonfire-moygashel-migrant-boat.html
2025-07-11-18-56-19 +0000,nyt,Haiti’s Landmark Oloffson Hotel is Destroyed in an Apparent Arson Fire,https://www.nytimes.com/2025/07/07/world/americas/haiti-oloffson-hotel-fire-port-au-prince.html
2025-07-11-18-22-44 +0000,nyt,Republicans Blame Canada for Wildfire Smoke ‘Suffocating’ the U.S.,https://www.nytimes.com/2025/07/11/world/canada/wildfire-smoke-manitoba-us-congress.html
2025-07-11-17-45-57 +0000,nyt,Strava Fitness App Revealed Locations of Swedish Leaders,https://www.nytimes.com/2025/07/11/world/europe/strava-sweden-bodyguards-prime-minister.html
2025-07-11-17-38-43 +0000,bbc,Rayner in deepening row with union over bin strikes,https://www.bbc.com/news/articles/cx24de0d9rdo
2025-07-11-17-28-33 +0000,nyt,"At Least 13 People Died by Suicide Amid U.K. Post Office Scandal, Report Says",https://www.nytimes.com/2025/07/10/world/europe/uk-post-office-scandal-report.html
2025-07-11-17-01-01 +0000,bbc,MP Rupert Lowe cleared by standards watchdog,https://www.bbc.com/news/articles/ceq7z421pwzo
2025-07-11-16-57-34 +0000,bbc,Mother mourns 'beautiful' 12-year-old shot while watching TV during Kenya protests,https://www.bbc.com/news/articles/cd6gzx85gdqo
2025-07-11-16-29-33 +0000,nyt,"Germany Takes an Unassuming Approach to Tax Cuts, in Contrast to Trump",https://www.nytimes.com/2025/07/11/world/europe/germany-economy-tax-cuts.html
2025-07-11-16-24-19 +0000,bbc,Russians tell the BBC how they think the Ukraine war will end,https://www.bbc.com/news/videos/c1wp55wqq0lo
2025-07-11-16-04-05 +0000,bbc,Dozens taken to hospital after suspected mass overdose in Baltimore,https://www.bbc.com/news/articles/cp8m5jggjdgo
2025-07-11-15-51-14 +0000,nyt,Rubio and China’s Top Envoy Vie for Influence in Asia Over Trump’s Tariffs,https://www.nytimes.com/2025/07/11/us/politics/china-us-asia-tariffs.html
2025-07-11-15-47-19 +0000,bbc,Watch: Moment child gets stuck inside a claw machine,https://www.bbc.com/news/videos/cy8kgg5l037o
2025-07-11-15-41-42 +0000,bbc,"Gaza's largest functioning hospital facing disaster, medics warn, as Israel widens offensive",https://www.bbc.com/news/articles/cdx5zeywgrgo
2025-07-11-15-40-00 +0000,wsj,The Tragedy in Texas Broke the Implicit Promise of Summer Camp,https://www.wsj.com/lifestyle/relationships/the-tragedy-in-texas-broke-the-implicit-promise-of-summer-camp-254654be
2025-07-11-15-02-15 +0000,nyt,"Srebrenica, a Massacre Foretold, Still Casts Its Shadow",https://www.nytimes.com/2025/07/11/world/europe/srebrenica-massacre-bosnia.html
2025-07-11-14-44-50 +0000,nyt,"Celebrating Humanity, Stubbornly, at Europe’s Photography Mecca",https://www.nytimes.com/2025/07/11/arts/design/arles-france-rencontres-de-la-photographie.html
2025-07-11-14-39-27 +0000,nyt,20 Unforgettable Looks from Paris Couture Week,https://www.nytimes.com/2025/07/11/style/paris-couture-week-best-looks.html
2025-07-11-14-39-16 +0000,bbc,Ex-MP faces two-year wait for betting offences trial,https://www.bbc.com/news/articles/c056v0m56pyo
2025-07-11-14-27-19 +0000,bbc,Kurdish PKK burns guns in cauldron in big step towards ending Turkey conflict,https://www.bbc.com/news/articles/cyvj5v67ly9o
2025-07-11-13-52-37 +0000,bbc,"Nigeria can't take Venezuelan deportees from US, minister says",https://www.bbc.com/news/articles/c23gz78v5jjo
2025-07-11-13-41-02 +0000,bbc,More than 150 arrests in global human trafficking crackdown,https://www.bbc.com/news/articles/c36x3z1k18no
2025-07-11-13-34-12 +0000,bbc,"Iran could recover some enriched uranium after US strikes, Israeli official says",https://www.bbc.com/news/articles/cn0qzxvydz1o
2025-07-11-13-26-30 +0000,nyt,Manitoba Declares Second Wildfire Emergency in a Near-Record Year,https://www.nytimes.com/2025/07/11/world/canada/manitoba-wildfires-2025.html
2025-07-11-13-07-16 +0000,nyt,"As Climate Change Heats Up Europe’s Summers, Avignon Festival Tries to Adapt",https://www.nytimes.com/2025/07/11/theater/avignon-festival-heat-climate-change.html
2025-07-11-13-05-38 +0000,bbc,Ban on ticketless football fans set to become law,https://www.bbc.com/news/articles/crrqxey5pgyo
2025-07-11-12-59-26 +0000,nyt,Meet the French Game Show Contestant Who Won 646 Times in a Row (and 23 Cars),https://www.nytimes.com/2025/07/11/arts/television/france-game-show.html
2025-07-11-12-51-21 +0000,bbc,Government code aims to stop unfair parking charges,https://www.bbc.com/news/articles/c4g2ej63dv1o
2025-07-11-12-37-21 +0000,bbc,Ex-Reform MP investigated by standards commissioner,https://www.bbc.com/news/articles/czjk1pxzz29o
2025-07-11-12-00-00 +0000,wsj,Immigration Raids Reveal Holes in Government’s Tool to Verify Workers,https://www.wsj.com/politics/policy/e-verify-work-authorization-10582819
2025-07-11-11-55-51 +0000,bbc,Outrage builds over plan to force all Gazans to southern city,https://www.bbc.com/news/articles/c9dgv7v1d06o
